中文单位名,英文单位名
,"Engn Coll APF, Lab Informat & Network APF, Xian 710086, Peoples R China
;"
,"Engn Technol Res Ctr Chinese MateriaMed Qual Univ, Guangzhou, Guangdong, Peoples R China
;"
,"Engn Univ APF, Key Lab Network & Informat Secur APF, Hefei, Anhui, Peoples R China"
,"Ening Med Coll, Sch Pharm, Rizhao 276800, Peoples R China"
,"Environment and Conservation, Murdoch University, Perth, WA, China;"
,"Environment Management College of China, Qinghuangdao, China ;"
,"Environment Management College of China, Qinhuangdao, China;"
,"Environmental and Ecological Engineering, Purdue University, West Lfayette"
,"Environmental and Sustainability Institute, University of Exeter Penryn Campus, Penryn"
,"Environmental Management College of China, China ;"
,"Environmental Management College of China, Qinhuangdao, China ;"
,"Environmental Management College of China, Qinhuangdao, Hebei, China ;"
,"Environmental Management College of China,, Qinhuangdao,, Hebei,, China ;"
,"Environmental Science and Engineering Department in Southwest Forestry University, Yunnan 650224, China ;"
,Environmental Studies at Vassar College ;
,"Environmental Technology and Management, Link?ping University, Link?ping"
,"EOLE Laboratory, Faculty of Technology, University of Tlemcen, Bp 230, Tlemcen"
,"Equipment Engineering College, Engineering University of APF, Xi'an, 710086, China
;"
,"Equipment Engineering College, Engineering University of APF, Xi'an, China
;"
,"Equipment Manufacturing School, Engineering University of Hebei, Handan, China ;"
,"Erasmus China Law Centre, Erasmus School of Law, Erasmus University of Rotterdam, Rotterdam, Netherlands ;"
,"Erzincan Binali Y?ld?r?m University, Department of Civil Engineering, Yaln?zba? Campus, Erzincan"
,"Escuela Profesional de Ingeniería de Sistemas, Universidad Nacional de San Agustín de Arequipa, Characato"
,"EU International Relations and Diplomacy Department, EU-China Research Centre, College of Europe, Brugge, Belgium
;"
,"European Centre for Environment and Human Health, University of Exeter Medical School ;"
,"Experimental and Computational Mechanics Laboratory, Universidad Autónoma de Manizales, Antigua Estación del Ferrocarril, Edificio Fundadores C.P., Manizales"
,"Ezhou Univ, Dept Comp, Ezhou, Hubei, Peoples R China"
,"Facoltà di Giurisprudenza, Università degli Studi di Trento, Via Verdi 53, 38122, Trento, Italia ;"
,"Faculty of a Faculty of Mechanical Engineering and Mechatronics, Polytechnic University of Bucharest, Bucharest"
,"Faculty of Agriculture, University of Belgrade, Kraljice Marije 16, Belgrade, 11120
;"
,"Faculty of Applied Science and Technology, University of Kashmir, J and K"
,"Faculty of Biological and Environmental Science, ZhejiangWanli University, 315100, Ningbo, China
;"
,"Faculty of Chemical Engineering, Universiti Teknologi MARA, Permatang Pauh"
,"Faculty of Chemistry, Center for Ecological Safety, Yerevan State University, Yerevan"
,"Faculty of Civil Engineering, University of Transport and Communications, Hanoi"
,"Faculty of Commerce and Accountancy, Chulalongkorn University, Bangkok"
,"Faculty of Computer Sci. and Eng., Xi'an Univ. of Technol., Xi'an, China ;"
,"Faculty of Decorative Arts, Silpakorn University, Bangkok"
,"Faculty of Education, Souphanouvong University, Luangprabang"
,"Faculty of Electrical and Computer Science Engineering, Tarbiat Modares University, Tehran"
,"Faculty of Electrical and Control Engineering of Liao Ning Technical University, Huludao, 125105, China
;"
,"Faculty of Electrical and Information Engineering, Huainan Normal Universty, Huainan, Anhui, China
;"
,"Faculty of Electrical Engineering, Beijing New Media Technical College, Beijing, China ;"
,"Faculty of Electromechanical and Traffic Engineering, Nantong Science and Technology College, Nantong"
,"Faculty of Energy Management, Electric Power University, Hanoi"
,"Faculty of Engineering and Applied Science, University of Regina, SK"
,"Faculty of Engineering and Architecture, Ghent University, Research Group on Dynamical Systems and Control, Technologiepark 914, Zwijnaarde"
,"Faculty of Engineering and Green Technology, Universiti Tunku Abdul Rahman, Jalan Universiti Bandar Barat, Kampar"
,"Faculty of Engineering and Green Technology, Universiti Tunku Abdul Rahman, Jalan Universiti Bandar Barat, Kampar"
,"Faculty of Engineering and Information Sciences, University of Wollongong, Wollongong"
,"Faculty of Engineering, University of Geosciences, Wuhan, 430074, China
;"
,"Faculty of Engineering, University of Windsor, Windsor"
,"Faculty of Finance and Accounting, University of Economics, Prague and Institute of Economic Studies, Faculty of Social Sciences, Charles University, Prague ;"
,"Faculty of General Education, Zhengzhou Technology and Business University, Henan"
,"Faculty of Health Science, Suzuka University of Medical Science ;"
,"Faculty of Hydrocarbons, University of Ouargla, Ouargla"
,"Faculty of Information Technology and Communication Sciences, Tampere University, Tampere"
,"Faculty of Information Technology, Satya Wacana Christian University, Salatiga"
,"Faculty of Materials & Energy, Soutwest University, Chongqing, China ;"
,"Faculty of Materials and Energy, South West University, Chongqing, China ;"
,"Faculty of Materials Science and Chemistry University of Geosciences, Wuhan, China ;"
,"Faculty of Materials Science and Engineering, Kunmng University of Science and Technology, Kunming, China ;"
,"Faculty of Mechanical Engineering and Automation, Zhejiang Science and Technology University, Hangzhou, 310018, China
;"
,"Faculty of Mechanical Engineering, Department of Mechanics, Material Science and Engineering, Wroc?aw University of Science and Technology, Smoluchowskiego 25, Wroc?aw"
,"Faculty of Mechanical Engineering, University of Ljubljana, A?ker?eva 6, Ljubljana"
,"Faculty of Metallurgy and Materials, Kunming College of Metallurgy, Kunming, China ;"
,"Faculty of Process and Environmental Engineering, Lodz University of Technology, ul. Wolczanska 213, Lodz"
,"Faculty of Public Administration, Shanxi University of Finance and Economic, Taiyuan"
,"Faculty of Pure and Applied Science, Institute of Applied Physics, University of Tsukuba, 1-1-1 Tennoudai, Tsukuba, Ibaraki"
,"Faculty of Science and Technology, University of Canberra, Canberra"
,"Faculty of Science, Xi'an Aeaonautical University, Xi'an, China ;"
,"Faculty of Sciences Semlalia, Laboratory of Applied Organic Chemistry, Department of Chemistry, Cadi Ayyad University ;"
,"Fakult?t für Ingenieurwissenschaften, Abteilung Informatik und Angewandte Kognitionswissenschaft, Universit?t Duisburg-Essen, Lotharstra?e 65, Duisburg"
,"Fault Deformation, Sealing and Fluid Migration Scicncc and Technology Innovation Team in Colleges, Universities of Heilongjiane, Daqing, Heilongjiang, China;"
,"Fault Deformation, Sealing and Fluid Migration Science and Tech. Innovation Team in Colleges and Univ. of Heilongjiang, Daqing, China ;"
,"Fcgian Normal Univ, Fujian Prov Key Lab Plant Ecophysiol, Fuzhou, Fujian, Peoples R China"
,"Fcjian Agr & Forestry Univ, Coll Food Sci, Fuzhou, Fujian, Peoples R China
;"
,"FCLAB, Univ. Bourgogne Franche-Comté, UTBM, CNRS, Rue Ernest Thierry Mieg, Belfort"
,"Fduan Univ, Inst Brain Sci, Shanghai, Peoples R China
;"
,"Fed Univ Sao Carlos UFSCar, Sorocaba, *, *"
,"FEMTO-ST Institute, Univ. Bourgogne Franche-Comté, UTBM, CNRS, Rue Ernest Thierry Mieg, Belfort"
,"FianZhu Univ, Sch Informat & Control Engn, Shenyang 110168, Liaoning, Peoples R China
;"
,"Filin Univ, Coll Vet Med, Minist Educ, Key Lab Zoonosis, 5333 Xian Rd, Changchun 130062, Peoples R China
;"
,"Filin Univ, Sch Pharmaceut Sci, Changchun, Jilin, Peoples R China
;"
,"FilM Univ, State Key Lab Automot Simulat & Control, Changchun 130022, Jilin, Peoples R China
;"
,"FilM Univ, State Key Lab Inorgan Synth & Preparat Chem, Changchun 130012, Peoples R China"
,"Filozofska fakulteta Univerze v Ljubljani, Institut Jo?ef Stefan
;"
,"finance in the Stetson School of Business and Economics, Mercer University in, Macon, GA
;"
,"Fining Med Univ, Inst Neurobiol, Rizhao 272067, Shandong, Peoples R China
;"
,"Fining Univ, Dept Chem & Chem Engn, Qufu 273155, Shandong, Peoples R China"
,"First Aeronaut Coll, Dept Aeronaut Elect Engn, Xinyang 464000, Henan, Peoples R China"
,"First Affiliated Hosp Coll Med, Collaborat Innovat Ctr Diag & Treatment Infect Di, State Key Lab Diagnost & Treatment Infect Dis, Hangzhou, Zhejiang, Peoples R China
;"
,"First Affiliated Hospital of Henan College of Traditional Chinese Medicine, Zhengzhou, China ;"
,"First Affiliated Hospital of Jiamusi University, Jiamusi, China
;"
,"First Affiliated Hospital, Chongqing Medical Science University, Chongqing, 400016, China
;"
,"First Clin Med Coll, Dept Psychiat, Harbin, Peoples R China"
,"First Department of Orthopaedics, Affiliated Hospital of Medical College, Xi'an Jiantong University, Shaanxi, China. [email protected] ;"
,"Flaying Univ, Sch Math, Meizhou 514015, Peoples R China"
,"Flight Technology and Test Centre (FTTC), Faculty of Mechanical Engineering, Universiti Teknologi MARA (UiTM), Shah Alam, Selangor DE"
,"Fo Guang Univ, Dept Commun, Yi Land, Peoples R China
;"
,"Fo Shan Univ, Sch Transportat & Civil Engn & Architecture, Foshan 528000, Guangdong, Peoples R China
;"
,"Food and Chemical Engineering Department, College of Henan Quality Project, Pingdingshan, China
;"
,"Food Science and Engineering, Central South Forestry University of Science and Technology University, Changsha, China ;"
,"Fordham Univ, *, *, *
;"
,"Foreign Language College of Anyang University, Anyang"
,"Foreign Language College, Nan Yang Institute of Technology, Henan, China ;"
,"Foreign Language Department, Shaoguan University, Shaoguan"
,"Foreign Studies Department, Shandong Women's University, Jinan, Shandong Province"
,"Forens Sci Engn Res Ctr Univ Chongqing, 301 Baosheng Ave, Chongqing 401120, Peoples R China
;"
,"Forens Sci Engn Res Ctr Univ Chongqing, Chongqing, Peoples R China
;"
,"Forensic Judicial Appraisal Institute, Affiliated Hospital of Chifeng University, Chifeng, China ;"
,"Forensic Medicine School, Shan Xi Mediacal University, Taiyuan, China
;"
,"Forest Univ Southwestern China, Kunming 650224, Yunnan, Peoples R China
;"
,"Forestry Coll Inner Mongolia Agr Univ, Hohhot 010019, Peoples R China
;"
,"Forestry College of Giuzhou University, Guizhou, China
;"
,"Foshan Nanhai Guangdong Technol Univ, CNC Equipment Cooperat Innovat Inst, Foshan 528000, Guangdong, Peoples R China
;"
,"Foshan Nanhai Guangdong Technol Univ, CNC Equipment Cooperat Innovat Inst, Foshan 528000, Peoples R China
;"
,"Foshan Nanhai Guangdong Technol Univ, CNC Equipment Cooperat Innovat Inst, Foshan, Peoples R China
;"
,"Foshan Nanhai Guangdong Technology University CNC Equipment Innovation Institute, Foshan, China ;"
,"Foshan Polytech Coll, Dept Mech & Elect Engn, Foshan 528137, Peoples R China"
,"Foshan Polytech Coll, Elect Informat Dept, Foshan, Guangdong 528137, Peoples R China"
,"Foshan Polytech Coll, Sch Finance & Econ Management, Foshan, Peoples R China
;"
,"Foshan Polytechnic College, Foshan, China;"
,"Fourth Med Univ, Xjing Hosp, Dept Radiol, Xian, Shaanxi, Peoples R China"
,"Fourth MilitaryMed Univ, Tangdu Hosp, Dept Neurol, Xian 710038, Peoples R China"
,"Fourth Millitary Med Univ, Dept Immunol, State Key Lab Canc Biol, Xian 710069, Shaanxi, Peoples R China"
,"Fourth Peoples Hosp Jinan, Dept Cardiol, Sch Med, Tai Shan Med Coll, Jinan 250031, Peoples R China"
,"Free Univ Berlin, China Studies, Grad Sch East Asian Studies, Berlin, Germany"
,"Free Univ Berlin, Inst China Studies, Berlin, Germany"
,"Free Univ Berlin, Inst China Studies, Berlin, Germany"
,"Free Univ Berlin, Inst China Studies, Fabeckstr 23-25, D-14195 Berlin, Germany"
,"Free Univ Berlin, Inst Sinol China Studies, Berlin, Germany"
,"Friedrich-Alexander University Erlangen-Nürnberg (FAU), Department of Insurance Economics and Risk Management ;"
,"Friedrich-Alexander-Universit?t Erlangen-Nürnberg, Institute of Separation Science and Technology, Egerlandstrasse 3, Erlangen"
,"Friedrich-Alexander-Universit?t Erlangen-Nürnberg, Institute of Separation Science and Technology, Egerlandstrasse 3, Erlangen"
,"Fu Jian Med Univ, Sch Nursing, Fuzhou, Fujian, Peoples R China
;"
,"Fu Yang Teachers Coll, Sch Life Sci, Fu Yang, Anhui, Peoples R China
;"
,"Fuclan Univ, Dept Radiat Oncol, Shanghai Canc Ctr, Shanghai 200032, Peoples R China"
,"FudanUniv, Sch Pharm, Shanghai, Peoples R China"
,"Fudcm Univ, Sch Econ, 220 Handan Rd, Shanghai 200433, Peoples R China"
,"Fuijan Med Univ, Fac Pharm, Dept Pharmaceut Anal, Fuzhou 350004, Fujian, Peoples R China
;"
,"Fuijan Normal Univ, Fuzhou, Fuijan, Peoples R China"
,"Fujain Normal Univ, Coll Geog Sci, Key Lab Subtrop Mt Ecol, Fuzhou, Fujian, Peoples R China
;"
,"Fujian A & Univ, Coll Hort, Fujian Prov Key Lab Plant Funct Biol, Fuzhou 350002, Fujian, Peoples R China
;"
,"Fujian Business Univ, Dept Engn Management, Fuzhou 350012, Fujian, Peoples R China
;"
,"Fujian Business Univ, Dept Fdn, Fuzhou 350012, Fujian, Peoples R China
;"
,"Fujian Business Univ, Dept Tourism & Hotel Management, Fuzhou 350012, Fujian, Peoples R China
;"
,"Fujian Business Univ, Dept Tourism, Fuzhou, Fujian, Peoples R China
;"
,"Fujian Coll & Univ, Stomatol Key Lab, Fuzhou 350000, Peoples R China"
,"Fujian Coll & Univ, Stomatol Key Lab, Fuzhou, Peoples R China"
,"Fujian Coll Tradit Chinese Med, Dept Orthoped & Traumatol, Fuzhou 350003, Peoples R China"
,"Fujian Coll Tradit Chinese Med, Dept Orthoped & Traumatol, Fuzhou 350003, Peoples R China"
,"Fujian Coll Water Conservancy & Elect Power, Fujian 366000, Peoples R China"
,"Fujian Coll Water Conservancy & Elect Power, Fujian Appl Technol Engn Ctr Power Battery Mat, Yongan 366000, Fujian, Peoples R China
;"
,"Fujian Coll Water Conservancy & Elect Power, Fujian Appl Technol Engn Ctr Power Battery Mat, Yongan 366000, Fujian, Peoples R China
;"
,"Fujian Coll Water Conservancy & Elect Power, Yongan 366000, Peoples R China"
,"Fujian Collaborat Innovat Ctr Exploitat & Utiliza, Key Lab Marine Genet Resources Fujian Prov, State Key Lab Breeding Base Marine Genet Resource, Key Lab Marine Genet Resources,Inst State Ocean A, Xiamen 361005, Peoples R China"
,"Fujian Collaborat Innovat Ctr Exploitat & Utiliza, State Key Lab Breeding Base Marine Genet Resource, Key Lab Marine Genet Resources Fujian Prov,Inst O, Key Lab Marine Genet Resources,Marine Genet Resou, Xiamen 361005, Peoples R China"
,"Fujian Commerce Coll, Informat Management & Engn Dept, Fuzhou 350012, Peoples R China
;"
,"Fujian Elect Power Tech Coll, Quanzhou 362000, Peoples R China
;"
,"Fujian Electric Power Technical College, Quanzhou, China;"
,"Fujian Hwa Nan Womens Coll, 66 Xue Yuan Rd, Fuzhou 350108, Fujian, Peoples R China
;"
,"Fujian Hwa Nan Womens Coll, 66 XueYuan Rd, Fuzhou 350108, Fujian, Peoples R China
;"
,"Fujian Int Business & Econ Coll, Fuzhou 350016, Fujian, Peoples R China
;"
,"Fujian International Business and Economic College, Fuzhou, China;"
,"Fujian Jangxia Univ, Coll Business Adm, Fuzhou, Fujian, Peoples R China"
,"Fujian Key Lab Univ & Colleg Transducer Technol, Xiamen 361005, Peoples R China
;"
,"Fujian Key Laboratory of Advanced Materials, Department of Materials Science and Engineering, College of Materials, Xiamen, China;"
,"Fujian Key Laboratory of Advanced Materials, Department of Materials Science and Engineering, College of Materials, Xiamen, China;"
,"Fujian Key Laboratory of Advanced Materials, Department of Materials Science and Engineering, College of Materials, Xiamen, Fujian 361005, China
;"
,"Fujian Presch Educ Coll, Presch Educ Dept, Fuzhou, Fujian, Peoples R China"
,"Fujian Presch Educ Coll, Presch Educ Dept, Fuzhou, Fujian, Peoples R China"
,"Fujian Prov Coll & Univ Engn Res Ctr Plantat Sust, Fuzhou 350002, Fujian, Peoples R China
;"
,"Fujian Prov Hosp Clin Med Coll, Dept Cardiovasc Med, Fuzhou, Fujian, Peoples R China"
,"Fujian Prov Key Lab Univ Polymer Mat & Prod, Fuzhou 350118, Fujian, Peoples R China
;"
,"Fujian Province Key Laboratory of Automotive Electronics and Electric Drive, Fujian University ofTechnology, Fuzhou, China
;"
,"Fujian Provincial College of Medical Sciences, Fuzhou 350001, Fujian Province, China ;"
,"Fujian Provincial Key Laboratory of Information Processing and Intelligent Control (Minjiang University), Fuzhou, 350121, China
;"
,"Fujian Provincial University Engineering Research Center of Geological Engineering, Fuzhou, Fujian, China;"
,"Fujian Union Hosp Clin Med Coll, Dept Anesthesiol, Fuzhou, Fujian, Peoples R China"
,"Fujian Univ & Coll Engn Res Ctr Soft Plast Packag, Fuqing 350300, Fujian, Peoples R China
;"
,"Fujian Univ & Coll Engn Res Ctr Soft Plast Packag, Fuqing 350300, Fujian, Peoples R China
;"
,"Fujian Univ & Coll Engn Res Ctr Soft Plast Packag, Fuzhou 350300, Fujian, Peoples R China
;"
,"Fujian Univ & Coll Engn Res Ctr Soft Plast Packag, Fuzhou 350300, Fujian, Peoples R China
;"
,"Fujian Univ Agr & Forestry, Coll Food Sci, Fuzhou 350002, Fujian, Peoples R China"
,"Fujian Univ Int Studies & Trade, Fuzhou, Fujian, Peoples R China
;"
,"Fujian Univ Med, NICU, Fuzhou Childrens Hosp Fujian Prov, Fuzhou 350005, Fujian, Peoples R China"
,"Fujian Univ Stomatol Biomat, Engn Res Ctr, Fuzhou, Fujian, Peoples R China
;"
,"Fujian Univ Techol, Fujian Prov Key Lab Big Data Min & Applicat, Fuzhou, Fujian, Peoples R China
;"
,"Fujian Univ Techol, Fujian Prov Key Lab Big Data Min & Applicat, Fuzhou, Fujian, Peoples R China
;"
,"Fujian University of International Studies and Trade, Fujian Province, China;"
,"Fujian University of International Studies and Trade, Fujian Province, China;"
,"Fujian University, Laboratory of Intelligent Computing and Information Processing, Quanzhou, Fujian"
,"Fujiang Agr & Forestry Univ, Coll Marxism, Fuzhou, Peoples R China"
,"FujianMed Univ, Dept Ophthalmol, Affiliated Hosp 1, 20 Chazhong Rd, Fuzhou 350005, Fujian, Peoples R China
;"
,"Fukien Univ Technol, Dept Comp Sci, GM Informat Coll, Fuzhou, Peoples R China"
,"Functional Textiles Engineering Research Center, Key Laboratory of Eco-Textiles, College of Textile &Clothing, Wuxi, China
;"
,"Furan Univ, Dept Phys, Shanghai 200433, Peoples R China"
,"Furan Univ, Husham Hosp, Dept Cardiol, Shanghai, Peoples R China
;"
,"Furan Univ, Surface Phys Lab, Shanghai 200433, Peoples R China"
,"Furong College Hunan, University of Arts and Science, Hunan Changde, 415000, China
;"
,"Fushun Teachers Coll, Dept Biochem, Fushun 113000, Liaoning, Peoples R China"
,"Fushun Technician Coll, Fushun 113123, Liaoning, Peoples R China
;"
,"Future Energy Center, School of Business, Society and Engineering, M?lardalen University, V?ster?s"
,"Future Manufacturing Processes Research Group, School of Mechanical Engineering, University of Leeds, Leeds"
,"Fuxin Coll, Coll Sci, Fuxing 123000, Liaoning, Peoples R China"
,"Fuzhou Coll Foreign Studies & Trade, Fuzhou 350203, Peoples R China"
,"Fuzhou Coll Foreign Studies & Trade, Fuzhou, Peoples R China
;"
,"Fuzhou Coll Foreign Studies & Trade, Sch Management, Fuzhou 350202, Fujian, Peoples R China"
,"Fuzhou College of Foreign Studies and Trade, No. 28, Yuhuan Road, Changle, Fuzhou City, Fujian Province, China ;"
,"Fuzhou Fujian, Coll Civil Engn, Fuzhou 350000, Fujian, Peoples R China
;"
,"Fuzhou Inst Technol, Coll Arts & Sci, Fuzhou 350506, Fujian, Peoples R China
;"
,"Fuzhou Normal Univ, Minist Educ, Key Lab Humid Subtrop Ecogeog Proc, Shangsan Rd, Fuzhou 350007, Fujian, Peoples R China
;"
,"Fuzhou Polytech, Coll Intelligence Robot, Fuzhou 350108, Fujian, Peoples R China
;"
,"Fuzhou Polytech, Coll Robot, 8 Lianrong Rd, Fuzhou Univ Town 350108, Fujian, Peoples R China
;"
,"Fuzhou Polytech, Coll Robot, 8 Lianrong Rd, Fuzhou Univ Town 350108, Fujian, Peoples R China
;"
,"Fuzhou Univ Foreign Studies & Trade, Dept Econ & Trade, Fuzhou 350202, Peoples R China
;"
,"Fuzhou Univ sity, Sch Mech Engn & Automat, Lab Opt Terahertz & Nondestruct Testing, Fuzhou 350108, Fujian, Peoples R China
;"
,"Fuzhou Univ Technol, Coll Informat Sci & Engn, Fuzhou, Peoples R China"
,"Fuzhou Univ Technol, Dept Civil & Engn, 2 Xueyuan Rd, Fuzhou 350116, Fujian, Peoples R China
;"
,"Fuzhou University and Key Lab of Spatial Data Mining & Information Sharing of MOE, Spatial Information Research Center, Fuzhou,Fujian, China ;"
,"Fuzhou Universitym, Fujian Key Lab Med Instrumentat & Pharmaceut Tech, Fuzhou 350108, Fujian, Peoples R China"
,"Fuzhow Univ Int Studies & Trade, Dept Business Adm, Fuzhou 350202, Fujian, Peoples R China
;"
,"Fzuzhou university and College of Physics and Information Engineering, Fuzhou,Fujian, China ;"
,"Gachon Univ, Coll Pharm, 191 Hambakmoei Ro, Incheon 406799, Peoples R China"
,"Gachon Univ, Dept Chem, Seongnam Si 461701, Gyeonggi Do, Peoples R China"
,"Gakushuin University, China
;"
,"Gan Nan Normal Univ, Coll Life & Environm Sci, Ganzhou, Peoples R China
;"
,"Gan Su Med Coll, Pingliang 744000, Gansu, Peoples R China
;"
,"Ganan Med Univ, Minist Educ, Key Lab Prevent & Treatment Cardiovasc & Cerebrov, Ganzhou 341000, Peoples R China
;"
,"Gangzhou Univ, Sch Geog Sci, Guangzhou 510006, Guangdong, Peoples R China
;"
,"Gannan Norma Univ, Chem Inst, Key Lab Organopharmaceut, Ganzhou 341000, Peoples R China
;"
,"Gansu Animal Husbandry Engineering Technical College, Wuwei, Gansu, 733006, China
;"
,"Gansu Coll Agr Technol, Lanzhou 730020, Peoples R China"
,"Gansu Coll Agr Technol, Lanzhou 730020, Peoples R China"
,"Gansu Ind Occupat Technol Coll, Tianshui 741025, Peoples R China"
,"Gansu Ind Occupat Technol Coll, Tianshui 741025, Peoples R China"
,"Gansu Ind Polytech Coll, Coll Chem Engn, Tianshui, Peoples R China
;"
,"Gansu Ind Polytech Coll, Sch Chem Engn, Tianshui 741025, Gansu, Peoples R China
;"
,"Gansu Ind Polytech Coll, Sch Chem Engn, Tianshui, Peoples R China
;"
,"Gansu Ind Polytech Coll, Sch Geol, Tianshui 741025, Peoples R China"
,"Gansu Ind Polytech Coll, Tianshui 741025, Gansu, Peoples R China"
,"Gansu Ind Polytech Coll, Tianshui 741025, Peoples R China
;"
,"Gansu Med Coll, Affiliated Hosp 2, Hosp PingLiang City 2, Dept Radiotherapy, Pingliang, Peoples R China"
,"Gansu Med Coll, Dept Chem, Pingliang 744000, Gansu, Peoples R China"
,"Gansu Med Coll, Dept Pathogen Biol, Pingliang, Peoples R China"
,"Gansu Med Coll, Pingliang, Gansu, Peoples R China"
,"Gansu Normail Univ Nationalities, Dept Chem & Life Sci, Hezuo, Peoples R China
;"
,"Gansu Polytech Coll Anim Husb & Engn, Huangyangzhen 733006, Peoples R China"
,"Gansu Polytech Coll Anim Husb Engn, Dept Econ Trade & Humanities, Wuwei, Peoples R China
;"
,"Gansu Polytechnic College of Animal Husbandry and Engineering, Wuwei, Gansu, 733006, China
;"
,"Ganzhou Med Coll, Affiliated Hosp 3, Dept Endocrinol & Metab, Ganzhou, Jiangxi, Peoples R China"
,"Ganzhou Med Univ, Affiliated Hosp 1, Dept Oncol, Ganzhou, Peoples R China
;"
,"Garman Med Coll, Dept Biochem & Mol Biol, Ganzhou, Peoples R China"
,"Gastroenterology Ward, Affiliated Hospital of Yan'an University, Yan'an, 716000, China
;"
,"Gasu Polytech Coll Anim Husb & Engn, Wuwei 733006, Peoples R China
;"
,"Gaungdong Univ Technol, Sch Chem Engn & Light Ind, HEMC, 100 West Waihuan Rd,4 Panyu Dist, Guangzhou 510006, Guangdong, Peoples R China
;"
,"Gaungxi Sci & Technol Normal Univ, Coll Food & Biochem Engn, Laibin 546199, Peoples R China"
,"Gausu Agr Univ, Coll Resources & Environm Sci, Lanzhou 730070, Peoples R China
;"
,"Gausu Agricultural University, College of Resources and Environmental Science, Lanzhou, China ;"
,"Geneva Coll, Liberal Arts, Shanghai, Peoples R China"
,"Geografía y Ordenación Territorial, División de Estudios Históricos y Humanos, del Departamento de Geografía y Ordenación Territorial, del CUCSH, de la Universidad de Guadalajara
;"
,"Geography and Environment College of Northwest Normal University, Lanzhou, China ;"
,"Geological Engineering Research Center, Fujian Provincial University, Fuzhou, 350116, China
;"
,"Geological Engineering Research Center, Fujian Provincial University, Fuzhou, Fujian, China;"
,"Geological Engineering Research Center, Fujian Provincial University, Fuzhou, Fujian, China;"
,"Geology Department, Kasdi Merbah University, Ouargla. BP 511, Ouargla"
,"Geophysics and Oil Resource Institute, Yangzte University, Wuhan, China ;"
,"George Mason University-Health Administration and Policy
;"
,Georgetown University. ;
,"Geosci Ocean Univ China, Coll Marine, Minist Educ, Key Lab Submarine Geosci & Prospecting Tech, Qingdao, Shandong, Peoples R China
;"
,"German Embassy, Schwarzman Coll, Beijing, Peoples R China
;"
,"Giuzhou Normal Univ, Sch Math Sci, Guiyang 550001, Guizhou, Peoples R China"
,"Goa Univ, Dept Phys, Goa 403206, Peoples R China"
,"Gongchengbing Coll, Xuzhou 221004, Jiangsu, Peoples R China"
,"Govt Coll Women, Dept Phys, Jind 126102, Haryana, Peoples R China
;"
,"Graduate Institute of Education, National Changhua University of Education, China ;"
,"Graduate Institute of Nursing, College of Medicine and Nursing, Hungkuang University, China ;"
,"Graduate Program in Electrical Engineering, Universidade Federal de Minas Germs, Av. Ant?nio Carlos 6627, Belo Horizonte, MG"
,"Graduate School of Advanced Imaging Science, Multimedia and Film, Chung-Ang University, China ;"
,"Graduate School of Agriculture, Hokkaido University, Kita 9 Nishi 9, Sapporo"
,"Graduate School of Bioresources, Mie University, 1577, Tsu"
,"Graduate School of Engineering, Kyushu University, 744 Motooka Nishi-ku, Fukuoka"
,"Graduate School of Engineering, Nagoya Institute of Technology: Faculty of Health Science, Nihon Fukushi Univ ;"
,"Graduate School of Engineering, Tohoku University, Sendai"
,"Graduate School of Information Science, Nagoya University, China
;"
,"Graduate School of Pure and Applied Sciences, University of Tsukuba, 1-1-1 Tennoudai, Tsukuba, Ibaraki"
