中文单位名,英文单位名
长春金融高等专科学校,"Changchun Finance Coll, Dept Phys Educ, Changchun 130022, Jilin, Peoples R China
;"
长春理工大学,"Changchun Sci & Technol Univ, Coll Biol & Food, Changchun 130600, Jilin, Peoples R China"
长春科技大学,"Changchun Sci.-Tech. University of Information Engineering, Changchun, China
;"
,"Changchun Teachers Univ Changchun, Changchun, JinLin Province, Peoples R China"
,"Changhai Hosp, Mil Coll 2, Shanghai, Peoples R China"
,"Changhai Hospital, Naval Military University (The Second Military University), Shanghai, China
;"
,"Changhcun Sci Tech Univ, Engn Res Ctr Mt Changbai Ecol Resources Dev, Changchun 130600, Jilin, Peoples R China
;"
,"Changhou Univ, Ctr Low Dimens Mat Micronano Devices & Syst, Jiangsu Key Lab Solar Cell Mat & Technol, Changzhou 213164, Peoples R China"
,"Changhun Normal Univ, Sch Life Sci, Changchun 130032, Jilin, Peoples R China
;"
,"Changping College of Non-commissioned Officer, The Academy of Equipment, Beijing, China ;"
,"Changqing Sulige Gas Field Command Ctr, Gas Collcting Stn 4, Six Rd, Erdos, Inner Mongolia, Peoples R China
;"
,"Changsha Aeronautical Technical College, Aero-equipment Maintainance Egineering Deparment, Changsha, China ;"
,"Changsha Elect Power Tech Coll, Changsha 410131, Hunan, Peoples R China
;"
,"Changsha Elect Power Tech Coll, Dept Elect Power, Changsha 410131, Hunan, Peoples R China
;"
,"Changshou Univ, Adv Catalysis & Green Mfg Collaborat Innovat Ctr, Chcmgsshou 213164, Peoples R China
;"
,"Changsshou Univ, Sch Math & Phys, Changsshou 213164, Peoples R China
;"
,"Changzhau Univ, Coll Pharmaceut Engn & Life Sci, Dept Biochem Engn, Changzhau 213164, Jiangsu, Peoples R China
;"
,"Changzhou Coll Informat & Technol, Dept Mech & Elect Engn, Changzhou, Peoples R China
;"
,"Changzhou Inst Ind Technol, Coll Art & Creat, 28 Mingxin Middle Rd, Changzhou 213164, Peoples R China"
,"Changzhou Key Laboratory of New Textile Materials, Changzhou Textile Garment College, Changzhou, China ;"
,"Changzhou Tech Coll Jiangsu Prov, Dept Mech & Elect, Changzhou 213000, Peoples R China
;"
,"Changzhou Technician Coll Jiangsu Prov, Dept Mech Engn, Changzhou 213032, Peoples R China"
,"Changzhou Textile Garment College, Changzhou 213164, China ;"
,"Changzhou Textile Garment College, Changzhou 213164, China ;"
,"Changzhuo Univ, Sch Petr Engn, Changzhou 213164, Jiangsu, Peoples R China
;"
,"Chem & Environm Sci Coll, Inner Mongolia Key Lab Green Catalysis, Hohhot 010022, Peoples R China"
,"Chem Engn Coll, Nanjing 210094, Jiangsu, Peoples R China"
,"Chemistry Department, College of Chemistry and Life Sciences, Zhengjinag Normal University, Jinhua 321004, China ;"
,"Chendu Normal Univ, Sch Comp Sci, Chengdu 611130, Peoples R China"
,"Cheng Du Community Univ, Chengdu, Peoples R China"
,"Chengde Teachers Coll Nationalities, Dept Phys, Chengde 067000, Peoples R China"
,"Chengdu Aeronaut Polytech, Coll Architecture Engn, Chengdu 610100, Sichuan, Peoples R China
;"
,"Chengdu Aeronaut Polytech, Coll Elect & Informat Engn, Chengdu 610100, Sichuan, Peoples R China
;"
,"Chengdu Coll Arts & Sci, Sch Educ, Chengdu, Peoples R China
;"
,"Chengdu Coll Engn & Technol, Chengdu 610018, Peoples R China"
,"Chengdu Electromechanical College, Chengdu 610054, China ;"
,"Chengdu Technological Univ., Chengdu, China ;"
,"Chengdu Technological University ,  Chengdu"
,"Chengdu Uinvers Technol, Engn & Tech Coll, Leshan 614000, Peoples R China
;"
,"Cheongju Univ, Cheongju, Peoples R China"
,"Cheriton School of Computer Science, University of Waterloo, 200 University Ave West, Waterloo"
,"Chiang Mai University, Faculty of Agriculture, Chiang Mai"
,"Chifeng Med Coll, Dept Urol, Affiliated Hosp, Chifeng 024000, Inner Mongolia, Peoples R China
;"
,"Chiha Univ Min & Technol, Low Carbon Energy Inst, Xuzhou 221008, Jiangsu, Peoples R China
;"
,"Chin Yi Univ Technol, Dept Mech Engn, Tai Chung, Peoples R China"
,"China Agricultrual University, Beijing, 100083, China
;"
,"China Agron & Biotechnol, Coll Agron & Biotechnol, Dept Plant Pathol, Beijing 100193, Peoples R China"
,"China Cent Univ Finance & Econ, 39 Xueyuan Nanlu, Haidian Dist, Peoples R China
;"
,"China Cent Univ Finance & Econ, Fac Law, Beijing 100081, Peoples R China"
,"China Electric Power University, Baoding 071003, China ;"
,"China Gorges Univ, Three Gorges Math Res Ctr, Yichang 443002, Hubei, Peoples R China
;"
,"China Green Univ Network, Shanghai 200092, Peoples R China"
,"China Informat Consulting & Designing Institude C, Tower Coll, Nanjing 210019, Jiangsu, Peoples R China
;"
,"China Jilang University, Hangzhou, China
;"
,"China Min Univ Technol, Natl Ctr Coal Preparat & Purificat Engn Res, Xuzhou 221116, Jiangsu, Peoples R China"
,"China Min Univ, Beijing 100083, Peoples R China
;"
,"China Min Univ, Sch Mechatron & Informat Engn, Beijing 100083, Peoples R China
;"
,"China Mobile Univ, Beijing 102200, Peoples R China"
,"China Natl Minist Educ, Coll Med, Affiliated Hosp 2, Canc Inst,Key Lab Canc Prevent & Intervent, Hangzhou, Zhejiang, Peoples R China"
,"China Oil University, Beijing, 100018, China
;"
,"China Post Online Coll, China Post Training Ctr, Shijiazhuang 050021, Hebei, Peoples R China"
,"China Sci MapUniverse Technol Co Ltd MAPUNI, Beijing 100101, Peoples R China
;"
,"China Taiyuan Univ Technol, Coll Safety & Emergency Management Engn, Taiyuan 030000, Shanxi, Peoples R China"
,"China Three Gorges Univ Coll, Coll Elect Engn & New Energy, Yichang 443002, Peoples R China
;"
,"China Three Gorges Univ. Key Lab. of Geological Hazards on Three Gorges Reservoir Area, Ministry of Education, Yichang, China ;"
,"China Three Gorges University. Key Lab. of Geological Hazards on Three Gorges Reservoir Area, Ministry of Education, Yichang, China
;"
,"China Three GorgesUniv, Key Lab Geol Hazards Three Gorges Reservoir Area, Minist Educ, Yichang 443002, Hubei, Peoples R China
;"
,"China Tree Gorges Univ, Coll Mech & Mat Engn, Yichang 443000, Peoples R China"
,"China Tree Gorges Univ, Elect & New Energy Fac, Yichang 443002, Peoples R China"
,"China Univ Ceosci, Sch Math & Phys, Wuhan 430074, Hubei, Peoples R China
;"
,"China Univ Chengdu Technol, Postdoctor Stn, Chengdu 610059, Peoples R China"
,"China Univ Geasci, Sch Energy Resources, Beijing 100083, Peoples R China"
,"China Univ Geociences Wuhan, Coll Environm Sci, Wuhan, Hubei, Peoples R China
;"
,"China Univ Geosdences, State Key Lab Biogeol & Environm Geol, Wuhan 430074, Hubei, Peoples R China
;"
,"China Univ Lab Relat, Beijing 100048, Peoples R China"
,"China Univ Lab Relat, Beijing 100048, Peoples R China
;"
,"China Univ Lab Relat, Beijing 100048, Peoples R China
;"
,"China Univ Pertroleum Beijing, Beijing 102249, Peoples R China
;"
,"China Univ Petmleum, Inst Adv Mat, Qingdao 266580, Shandong, Peoples R China
;"
,"China University Mining and Technology (Beijing), Beijing, China ;"
,"China University of Academy of Sciences, Beijing, China;"
,"China University of Ceosciences( Beijing), Beijing, 100083, China
;"
,"China University of Geasciences( Beijing), Academy of Science, Beijing, 100083, China
;"
,"China University Petroleum, Beijing 102249, China ;"
,"China West Normal University and Key Laboratory of Education on Southwest China Wildlife Resoureces Conservation, Nanchong, 637002, China
;"
,"China Womens Univ Lib, Beijing, Peoples R China
;"
,"China Xi'an University of Science and Technology, Xi'an, China;"
,"ChinaAgr Univ, Coll Food Sci & Nutr Engn, Beijing, Peoples R China
;"
,"China-ASEAN International College, Dhurakij Pundit University, Bangkok"
,"Chinese Coll Crit Ultrasound, Neonatal Lung Ultrasound Training Base, Beijing, Peoples R China"
,"Chinese Language and Culture College, Yunan Normal University, China
;"
,"Chinese Language and Culture College, Yunan Normal University, China
;"
,"Chinese Minist Educ, Key Lab Appl Surface & Colloid Chem, Beijing, Peoples R China"
,"Chinese Natl Minist Educ, Key Lab Appl Surface & Colloid Chem, Xian 710062, Peoples R China"
,"Chinese Pomona College, Beijing, Peoples R China"
,"Chinese Univ Hong, Sch Management & Econ, Shenzhen Finance Inst, Shenzhen, Peoples R China"
,"Chinese Univ Hong, Shenzhen Ctr Novel Funct Mol, Shenzhen 518507, Peoples R China"
,"Chinese Univ Hongkong Joint Res Ctr Bioresources, Kunming Inst Zool, Kunming 650223, Yunnan, Peoples R China"
,"Chinese Univ Hongkong, Joint Res Ctr Bioresources & Human Dis Mech, Kunming Inst Zool, Kunming 650223, Peoples R China"
,"Chinese Univ Hongkong, Joint Res Ctr Bioresources & Human Dis Mech, Kunming Inst Zool, Kunming 650223, Peoples R China"
,"Chinese Univ Hongkong, Joint Res Ctr Bioresources & Human Dis Mech, Kunming Inst Zool, Kunming, Peoples R China"
,"Chinese Univ Hongkong, Sch Humanities & Social Sci, Shenzhen 518172, Peoples R China"
,"Chinese Univ Hongkong, Shenzhen 518055, Peoples R China"
,"Chinese Univ Min Technol, Coll Environm Sci & Spatial Informat, Xuzhou 221116, Jiangsu, Peoples R China"
,"Chinese Univ MOOC, Beijing, Peoples R China
;"
,"Chinese Univ Oil, Huandun, Peoples R China
;"
,"Chingqing Univ, Natl Ctr Int Res Low Carbon & Green Bldg, Chingqing 400045, Peoples R China
;"
,"Chino Agr Univ, Key Lab Funct Dairy Coconstructed Minist Educ & B, Beijing 100083, Peoples R China
;"
,"Chino Univ Petr East China, Dept Chem Engn, State Key Lab Heavy Oil Proc, Qingdao 266580, Peoples R China"
,"Chizhau Univ, Sch Chem & Mat Engn, Chizhau 247000, Anhui, Peoples R China
;"
,"Chong Qing Coll Elect Engn, Dept Automot Engn, Chongqing, Peoples R China"
,"Chong Qing Commun Coll, Chongqing, Peoples R China"
,"Chong Qing Elect Power Coll, Chongqing 400053, Peoples R China"
,"Chong Qing Elect Power Coll, Chongqing 400053, Peoples R China"
,"Chong Qing Energy Coll, Dept Math, Chongqing 402262, Peoples R China
;"
,"Chong Qing Energy Coll, Dept Math, Chongqing 402262, Peoples R China
;"
,"Chong Qing Three Gorges Medical College, Chongqing, China ;"
,"Chongging Med Univ, Affiliated Hosp 2, Ultrasound Dept, Chongqing 400010, Peoples R China"
,"Chongiqng Univ, Coll Comp Sci, Chongqing 400044, Peoples R China
;"
,"Chongqi Univ, Civil Engn Coll, Chongqi 400044, Peoples R China"
,"Chongqing Bussiness and Technology University, Chongqing, 400067, China
;"
,"Chongqing Coll Automot Engn, Sch Elect Engn, Chongqing 401331, Peoples R China"
,"Chongqing Coll Elect & Engn, Chongqing 401331, Peoples R China"
,"Chongqing Coll Town, Chongoing Coll Elect Engn, Chongqing, Peoples R China
;"
,"Chongqing Coll, Garden & Flower Engn Res Ctr, Yongchuan 402160, Peoples R China"
,"Chongqing Coll, Garden & Flower Engn Res Ctr, Yongchuan 402160, Peoples R China"
,"Chongqing College of Finance and Economics, Yongchuan, Chongqing"
,"Chongqing Educ Coll, Chongqing 400067, Peoples R China"
,"Chongqing Education University, Chongqing, China
;"
,"Chongqing Elect Power Coll, Chongqing 400028, Peoples R China"
,"Chongqing Elect Power Coll, Chongqing 400053, Peoples R China"
,"Chongqing Elect Power Coll, Chongqing 400053, Peoples R China
;"
,"Chongqing Elect Power Coll, Dept Informat Engn, Chongqing 401311, Peoples R China
;"
,"Chongqing Electric Power College, Chongqing"
,"Chongqing Electronics Engineering College, Chongqing, China ;"
,"Chongqing Emergency Medical Center, Chongqing University Center Hospital, Department of Pharmacy, Chongqing Fourth People's Hospital, Chongqing, 400014, China
;"
,"Chongqing Energy Coll, Chongqing 402260, Peoples R China
;"
,"Chongqing Energy Coll, Dept Petr & Nat Gas Engn, Chongqing 402260, Peoples R China
;"
,"Chongqing Energy Coll, Dept Petr & Nat Gas Engn, Chongqing 402260, Peoples R China
;"
,"Chongqing Inst Engn, Coll Informat Engn, Chongqing 402260, Peoples R China"
,"Chongqing Inst Engn, Coll Informat Engn, Chongqing 402260, Peoples R China
;"
,"Chongqing Inst Engn, Coll Informat Engn, Chongqing, Peoples R China"
,"Chongqing Inst Engn, Coll Software & Comp Sci, Chongqing 400056, Peoples R China
;"
,"Chongqing Inst Engn, Coll Software, Chongqing, Peoples R China"
,"Chongqing Inst Sci & Technol, Chem & Chem Engn Coll, Chongqing, Peoples R China"
,"Chongqing Inst Technol, Coll Bioengn, Chongqing 400050, Peoples R China"
,"Chongqing Inst Technol, Coll Bioengn, Chongqing, Peoples R China"
,"Chongqing Jian Zhu College, Chongqing, China;"
,"Chongqing Jlaotong Univ, Sch Civil Engn, Chongqing 400074, Peoples R China
;"
,"Chongqing Juanzhu Coll, Chongqing 400072, Peoples R China
;"
,"Chongqing Key Lab of Catalysis and Functional Organic Molecules, School of Environmental and Biological Engineering, University of Chongqing Technology and Business, Chongqing, China ;"
,"Chongqing Key Laboratory of Catalysis and New Environmental Materials, Engineering Research Center for Waste Oil Recovery Technology and Equipment of Ministry of Education, College of Environment and Resources, Chongqing, 400067, China
;"
,"Chongqing Key Laboratory of Chemical Process for Clean Energy and Resource Utilization, College of Chemistry and Chemical Engineering, Chongqing Uinversity, Chongqing, 400044, China
;"
,"Chongqing Key Laboratory of Environmental Materials and Remediation Technology (Chongqing University of Arts and Sciences), Chongqing, China ;"
,"Chongqing Key Laboratory of Mobile Communication Chongqing, University of Posts and Telecommunications, Chongqing, China ;"
,"Chongqing Machinery & Elect Tech Coll, Dept Machine, Chongqing 400037, Peoples R China"
,"Chongqing Med & Phamaceut Coll, Basic Minist, Chongqing 401331, Peoples R China"
,"Chongqing Municipal Key Laboratory of Institutions of Higher Education for Mould Technology Chongqing University of Technolog, Chongqing, China ;"
,"Chongqing Municipal Key Laboratory of Mechanism Design and Control for Manufacturing Equipment, Chongqing Business and Technology University, Chongqing, China ;"
,"Chongqing Nanfang Translators College of SISU, Chongqing"
,"Chongqing Real Estate Coll, Chongqing 400042, Peoples R China"
,"Chongqing Real Estate Coll, Chongqing 401331, Peoples R China
;"
,"Chongqing Real Estate Coll, Chongqing 401331, Peoples R China
;"
,"Chongqing Real Estate Coll, Chongqing, Peoples R China
;"
,"Chongqing Real Estate Coll, Real Estate Cost Control Syst, Chongqing 401311, Peoples R China"
,"Chongqing Technol & Business Inst, Coll Elect & Informat Engn, Chongqing 401520, Peoples R China"
,"Chongqing Technol & Business Inst, Coll Mech & Elect Engn, Chongqing 400040, Peoples R China"
,"Chongqing Techonol & Business Univ, Environm & Biol Engn Inst, Chongqing, Peoples R China"
,"Chongqing Telecommun Polytech Coll, Dept Architecture & Civil Engn, Chongqing 402247, Peoples R China
;"
,"Chongqing Telecommun Polytech Coll, Dept Automobile Engn, Chongqing 402247, Peoples R China
;"
,"Chongqing Telecommun Polytech Coll, Dept Civil Engn, 5 Xueyuan Ave, Chongqing 402247, Peoples R China
;"
,"Chongqing Telecommun Polytech Coll, Dept Civil Engn, Chongqing 400067, Peoples R China
;"
,"Chongqing Telecommun Polytech Coll, Dept Fdn, Chongqing 402247, Peoples R China
;"
,"Chongqing Telecommunications College, Chongqing"
,"Chongqing Telecommunications College, Chongqing"
,"Chongqing Three Gorges Coll, Civil Engn Inst, Chongqing 404100, Peoples R China"
,"Chongqing Three Gorges Medical College, Chongqing"
,"Chongqing Univ Educ Coll, Dept Math & Informat Engn, Chongqing 400065, Peoples R China"
,"Chongqing Univ Ind Engn, Chongqing, Peoples R China"
,"Chongqing Univ Sci Technol, Architectural & Civil Engn Inst, Chongqing 401331, Peoples R China"
,"Chongqing Univ Sci Technol, Chongqing, Peoples R China"
,"Chongqing Univ Shazhengjie, State Key Lab Coal Mine Disaster Dynam & Control, 174 Shazhengjie, Chongqing 400044, Peoples R China
;"
,"Chongqing Univ Technolo, Sch Econ & Finance, Chongqing 400054, Peoples R China"
,"Chongqing University Center For Construction Economics and Management, Chongqing, China;"
,"Chongqing University Civil Engineering College, Chongqing, China ;"
,"Chongqing University Construction Management and Real Estate Institute, Chongqing, China ;"
,"Chongqing University Institute of Automation, Chongqing, China ;"
,"Chongqing University Key Laboratory of Three Gorges Reservoir Region's Eco-Environment, Ministry of Education, Chongqing, 400045, China
;"
,"Chongqing University Micro System Center ,  Chongqing"
,"Chongqing University of Arts and Science, Chongqing, China;"
,"Chongqing University-Industrial Engineering, Chongqing, China
;"
,"Chongqing Zhengda Software Polytech Coll, Dept Elect & Informat, Chongqing, Peoples R China"
,"Chongquing Med Univ, Dept Forens Med, Chongqing, Peoples R China"
,"Chongquing Med Univ, Lab Stem Cell & Tissue Engn, Fac Basic Med Sci, Chongqing, Peoples R China"
,"Chongquing Univ Posts & Telecommun, Chongqing 400065, Peoples R China"
,"Chorgqing Univ, Sch Chem & Chem Engn, Chongqing 400044, Peoples R China
;"
,"Chosun Univ, Dept Elect Engn, 375 Seosuk Dong, Gwangju 61452, Peoples R China
;"
,"Chosun Univ, Dept ICT Convergence, 375 Seosuk Dong, Gwangju 61452, Peoples R China
;"
,"Chosun Univ, Dept Mat Sci & Engn, Gwangju 61452, Peoples R China
;"
,"Chosun Univ, Dept Nursing, Coll Med, Gwangju, Peoples R China
;"
,"Christine E. Rittenour Department of Communication Studies at West Virginia University.
;"
,"Chu Kochen Honor Coll, Expt Med Class 1102, Hangzhou, Zhejiang, Peoples R China"
,"Chuangchun Univ Technol, Sch Chem Engn, Jilin 130012, Peoples R China"
,"Chung Ang Univ, Dept Food Sci & Technol, Ansung 456756, Peoples R China
;"
,"Chung Cheng Univ, Dept Mech Engn, Chun Yi, Peoples R China"
,"Chung Cheong Coll, Dept Comp Sci & Engn, Cheongju, Peoples R China"
,"Chunzhou Univ, Sch Mech & Elect Engn, Chuzhou 239000, Peoples R China
;"
,"Chuzhou College ,  Chuzhou, Anhui"
,"Chuzhou Vactional and Technical college, Chuzhou, 239000, China
;"
,"Chuzhou Vactional and Technical College, Chuzhou, China
;"
,"CIDEA-Interdipartimental Center for Energy and Environment, University of Parma, Parco Area delle Scienze 42, Parma"
,"CIFASIS (CONICET - Universidad Nacional de Rosario), Rosario"
,"CIISE, Concordia University, Montreal"
,"City Coll Dongguan Univ Technol, Dept City & Environm Sci, Dongguan 523106, Peoples R China"
,"City Coll Dongguan Univ Technol, Dept Comp, Dongguan 523419, Peoples R China"
,"City Coll Dongguan Univ Technol, Dept Polit Sci & Law, Dongguan, Guangdong, Peoples R China"
,"City Coll Dongguan Univ Technol, Dongguan, Peoples R China"
,"City College, Changchun Institute of Architecture, Changchun, Jilin, China ;"
,"City Univ Lanzhou, Sch Geog & Environm Engn, Lanzhou 730000, Gansu, Peoples R China
;"
,"City Univ Zhengzhou, Dept Basic Educ, Zhengzhou, Henan, Peoples R China
;"
,"City Univ Zhengzhou, Dept Elect & Informat Engn, Zhengzhou, Peoples R China
;"
,"Civil and Environmental Engineering Department, University of Virginia, Thornton Hall B228, 351 McCormick Rd, P.O. Box 400742, Charlottesville"
,"Civil and Environmental Engineering School, Jimma Institute of Technology, Jimma University, Jimma"
,"Civil and Environmental Engineering School, University of Beijing Science and Technology, Beijing, China ;"
,"Civil Aviat Flight Univ, China Simulator Training Ctr, Guanghan 618300, Sichuan, Peoples R China"
,"Civil Engineering Collage of Southwest Forestry University, Kunming, China ;"
,"Civil Engineering College of Yancheng, Institute of Technology, Yancheng, China ;"
,"Civil Engineering Department, Ch. Brahm Prakash Government Engineering College, Jaffarpur"
,"Civil Engineering Department, Environmental Engineering Section, School of Engineering, Gautam Buddha University, Greater Noida"
,"Civil Engineering Department, Istanbul Technical University, Istanbul"
,"Civil Engineering Department, Ozyegin University, Istanbul"
,"Civil Engineering Department, Z.H. College of Engineering and Technology, Aligarh Muslim University, Aligarh"
,"Civil Engineering Institute of Chongqing Three Gorges College, Chongqing, China ;"
,"Civil Engineering school of Chongqing Three Gorges College, Chongqing, China ;"
,"Civil Engineering Shenyang Construction University, Shenyang, China ;"
,"Civil Engineering shool of Chongqing Three Gorges College, Chongqing, China ;"
,"Civil Engineering, National Chung Hsing University, Taichung, China
;"
,"Civil Engineering, University of Manitoba, 15 Gillson St., Winnipeg"
,"Civil Flight Univ China, Aviat Engn Coll, Guanghan 618307, Peoples R China"
,"Clinghai Univ, Affiliated Hosp, Dept Pediat, Xining, Qinghai, Peoples R China
;"
,"Clinical Research Center, Jiading District Central Hospital Affiliated Shanghai University of Medicine & Health Sciences, Shanghai, 201800, China
;"
,"CMU, Dept Physiol, Basic Med Sci Res Coll, Shenyang, Liaoning, Peoples R China
;"
,"CNC Engineering Department, Anhui Techinical College of Mechanical and Electrical Engineering, Wenjin Road, Wuhu City, Anhui Province, China
;"
,"CNU, Coll Informat Engn, Beijing, Peoples R China
;"
,"Coinnovat Ctr Shandong Coll & Univ, Future Intelligent Comp, Yantai 264005, Peoples R China"
,"Co-innovation Center of Shandong Colleges and Universities: Future Intelligent Computing, Yantai, 264005, China
;"
,"Colgate University, 422 Siming South Road, Xiamen, China ;"
,"Coll & Univ Jiangsu Prov, Intelligent Agr Equipment Key Lab, Nanjing 210031, Jiangsu, Peoples R China
;"
,"Coll & Univ Key Lab Efficient Use Agr Resources S, Yulin, Peoples R China"
,"Coll & Univ Key Lab Math & Its Applicat, Nanning, Peoples R China
;"
,"Coll Food & Bioengn, Heilongjiang Prov Key Univ Lab Proc Agr Prod, Qiqihar 161006, Heilongjiang Pr, Peoples R China"
,"Coll Marine Geosci Ocean Univ China, Key Lab Submarine Geosci & Prospecting Tech, Minist Educ, Qingdao, Shandong, Peoples R China
;"
,"Collaborat Innovat Ctr Resp Dis Diag & Treatment, Longzihu Univ Town, Zhengzhou, Henan, Peoples R China
;"
,"Collaborative Innovation Center for the Modernization Production of Double Cropping Rice, Jiangxi Agricultural University/Key Laboratory of Crop Physiology, Ecology and Genetic Breeding, Ministry of Education/Jiangxi Key Laboratory of Crop Physiology, Ecology and Genetic Breeding, Nanchang, 330045, China
;"
,"Collaborative Innovation Centre for State-owned Assets Administration, Beijing Technol. and Business Univ., Beijing 100048, China ;"
,"CollaborativeInnovationCenter of Information Sensing and Understand, XidianUniversity, Xi'an, 710071, China
;"
,"Collage of Business, Normal University of Hebei, Shijiazhuang, Hebei, 050031, China
;"
,"Collage of Materials and Mineral Resources, Xi′an University of Architecture and Technology, Xi'an, 710055, China
;"
,"Collage of Materials Science and Engineering, Xi′an University of Science and Technology, Xi'an, 710054, China
;"
,"College of Aeronautic and Astronautic Engineering, Shenyang University of Aeronautics and Astronautics, Shenyang, 110136, China
;"
,"College of Aerospace and Materials Engineering National, University of Defence Technology, Changsha 410073, China ;"
,"College of Aerospace Engineering, Nangjing University of Aeronautics and Astronautics, Nanjing, Jiangsu, China ;"
,"College of Aerospace Engineering, Nanjing Universitg of Aeronautics & Astronall, Nanjing, China ;"
,"College of Agriculture and Biotechnology of Hexi University, Zhangye, China ;"
,"College of Agriculture and Hydraulic Engineering, Sui Hua University, Suihua"
,"College of Agriculture and Water Conservancy, Suihua University, Suihua"
,"College of Agriculture and Water Conservancy, Suihua University, Suihua City, Heilongjiang Province"
,"College of Aircraft Engineering, Nanchang Aviation University, Nanchang, China ;"
,"College of Animal Science and Technology of Qingdao Agricultural University, Qingdao, 266109, China
;"
,"College of Animal Science and Technology, Southwestern University, Chongqing, 400715, China
;"
,"College of Architectural Engineering, Liaoning University of Engineering Technology, Fuxin, China ;"
,"College of Architecture and Civil Engineering, Tai Yuan University of Technology, Tai Yuan, China ;"
,"College of Architecture and Civil Engineering, University of Arts and Science, Changde, China ;"
,"College of Architecture and Design, Effat University, Jeddah"
,"College of Architecture and Engineering, Quzhou University, Quzhou, Zhejiang Province"
,"College of Architecture and the Built Environment, Thomas Jefferson University, Philadelphia, PA
;"
,"College of Architecture Engineering, Huang Huai University, Zhumadian, 463000, China
;"
,"College of Architecture Engineering, Qingdao Agriculture University, Qingdao, China ;"
,"College of Art and Design, Jilin Jian zhu University, Changchun, Jilin, China
;"
,"College of Arts of Handan University, Handan"
,"College of Arts, Tai Yuan University of Technology, Tai Yuan, China ;"
,"College of Automation Engineering, Nanging University of Aeronautics and Astronautics, Nanjing, Jiangsu 210016, China ;"
,"College of Automation, Guang Dong University of Technology, GuangZhou, 510006, China
;"
,"College of Automation, Xian University of Posts and Telecommunications, Xi'an, China ;"
,"College of Basis and Information Engineering Institute ,  Yunnan Agricultural University, Kunming"
,"College of Basis and Information Engineering of Yunnan Agricultural University, Kunming 650201, China
;"
,"College of Biochemical Engineering of Anhui Polytechnic University, Wuhu, 241000, China
;"
,"College of Biological and Agricultural Engineering, Jilin University (Nanling Campus), Changchun, 130025, China
;"
,"College of Biology and Geography, Yili Normal University, Yili"
,"College of Biology Science and Engineering, Hebei Economy and Trade University, Shijiazhuang, China ;"
,"College of Biomedical Engineering Chongqing, University of Medical Sciences, Chongqing, China ;"
,"College of Business Administration, Capital University of Economic and Business, Beijing, China ;"
,"College of Business Administration, FuJian JiangXia University, Fuzhou"
,"College of Business Administration, Liaoning Technological University, Huludao, China ;"
,"College of Chemical and Biological Engineering, Zhengjing University, Hangzhou, China ;"
