中文单位名,英文单位名
,"Science and Engineering Department, Sanya College, Sanya, Hainan, China ;"
,"Science and Technology College of Nanchang Hangkong University, Nanchang, 330063, China
;"
,"Science and Technology Dept of Hefei University, Anhui, Hefei 230601, China ;"
,"Science and Technology Innovation Team of Colleges and Universities in Heilongjiang, Hydrocarbon Accumulation and Preservation, Daqing, Heilongjiang, China ;"
,"Science and Technology Innovation Team of Universities of Fault Deformation, Sealing Properties and Fluid Migration, Daqing, Heilongjiang, China;"
,"Science and Technology Innovation Team of Universities of Fracture Deformation, Sealing Properties and Fluid Migration, Daqing, China ;"
,"Science and Technology on Combustion, Internal Flow and Thermo-Structure Laboratory, Science and Technology on Combustion, College of Astronauties, Nouthwestern Polytechnical University, Xi'an, 710072, China
;"
,"Science and Technology University of Suzhou, Electronic and Information Engineering Faculty, Suzhou, China ;"
,"Science College, Qiqihaer University, Qiqihaer, Heilongjiang, China ;"
,"Science Computing and Intelligent Information Processing of Guangxi Higher Education Key Laboratory (Guangxi Teachers Education University), Nanning, China ;"
,"Scientific Research Administration Division, Hu'nanUniversity of Commerce, Changsha, 410205, China
;"
,"Scoochow Univ, Robot & Microsyst Ctr, Suzhou 215021, Peoples R China
;"
,"Scoochow Univ, Robot & Microsyst Ctr, Suzhou 215021, Peoples R China
;"
,"Scott A. Myers Department of Communication Studies at West Virginia University.
;"
,Scottish Oceans Institute and School of Biology University of St Andrews St Andrews UK;
,"Scottish Oceans Institute and Sea Mammal Research Unit University of St Andrews St Andrews UK
;"
,"SDUST, Coll Mat Sci & Engn, Qingdao 266510, Shandong, Peoples R China"
,"SDUST, Coll Math & Syst Sci, Qingdao 266590, Shandong, Peoples R China
;"
,"SDUST, Geomat Coll, Qingdao 266590, Shandong, Peoples R China
;"
,"Second Affiliated Hosp, Coll Med, Canc Inst, Key Lab Canc Prevent & Intervent,Affiliated Hosp, Hangzhou 310009, Zhejiang, Peoples R China
;"
,"Second Clin Med Coll, Dept Neurol, Nanchong 637000, Sichuan Provinc, Peoples R China"
,"Second Clinical Medical School of Guangzhou University of CM
;"
,"Second Department of Preschool Education, Preschool Educators College, Jiangyou"
,"Second Hosp Univ, Dept Hematol, Shijiazhuang 050000, Hebei, Peoples R China
;"
,"Second Mili Med Univ, Dept Obstet & Gynecol, Affiliated Hosp 1, Changhai Rd 168, Shanghai 200433, Peoples R China
;"
,"Second Miliary Med Univ, Sch Nursing, Shanghai 200433, Peoples R China"
,"Second Milirmy Med Univ, Shanghai Eastern Hepatobiliary Surg Hosp, Dept Pharm, Shanghai 200438, Peoples R China
;"
,"Second MilitaryMed Univ, Changzheng Hosp, Dept Bone Tumor Surg, 415 Fengyang Rd, Shanghai 200003, Peoples R China"
,"Second Militmy Med Univ, Changhai Hosp, Dept Ophthalmol, 168 Changhai Rd, Shanghai 200433, Peoples R China"
,"Second Milittny Med Univ, Sch Pharm, Shanghai 200433, Peoples R China"
,"Second Millitary Med Univ, Changhai Hosipital, Dept Lab Med, Shanghai 200433, Peoples R China
;"
,"Second Millitary Med Univ, Changzheng Hosp Shanghai, Dept Neurosurg, Shanghai 200003, Peoples R China
;"
,"Second Millitary Med Univ, Changzheng Hosp, Dept Radiol & Nucl Med, Shanghai, Peoples R China"
,"Second Ningbo Technician College, Ningbo, China;"
,"Second Ningbo Technician College, Ningbo, China;"
,"Secondary Med Univ, Lab Anim Ctr, Shanghai 200433, Peoples R China"
,"Secong Militery Med Univ, Eastern Hepatobiliary Surg Hosp, Dept Hepat Surg 5, Shanghai 200438, Peoples R China"
,"Security Protection, Beijing College of Politics and La, Beijing, China ;"
,"SEEE, Sastra University ;"
,"SEU, Coll Civil Engn, 2 Sipailou, Nanjing 210096, Jiangsu, Peoples R China"
,"Seventh Department, Mechanics Engineering College, Shijiazhuang, China;"
,"Shaan Xi Normal Univ, Dept Appl Math, Xian 710062, Peoples R China"
,"Shaannan Eco-economy Research Center of Ankang University, Ankang, 725000, China
;"
,"Shaanxi Coll Commun Technol, Dept Automobile, Xian 710018, Shaanxi, Peoples R China"
,"Shaanxi Coll Commun Technol, Dept Automot Engn, Xian 710018, Peoples R China"
,"Shaanxi Coll Commun Technol, Dept Automot Engn, Xian, Peoples R China"
,"Shaanxi Coll Commun Technol, Sch Civil Engn & Geodesy, 19 Wenjing RD, Xian 710018, Shaanxi, Peoples R China
;"
,"Shaanxi Coll Commun Technol, Sch Econ & Management, Xian 710018, Shaanxi, Peoples R China
;"
,"Shaanxi Coll Commun Technol, Xian, Shaanxi, Peoples R China
;"
,"Shaanxi College of Chinese Medicine, Xianyang, China ;"
,"Shaanxi College of Communication Technology, Xi'an"
,"Shaanxi College of Communications Technology, Xi'an 710018, Shaanxi, China ;"
,"Shaanxi College of Communications Technology, Xi'an, China;"
,"Shaanxi College of Traditional Chinese Medicine, Xianyang 712046, China ;"
,"Shaanxi Ctr Stem Cells Engn & Technol, Coll Vet Med, Yangling, Shaanxi, Peoples R China
;"
,"Shaanxi Elect Tech Coll, Coll Comp Engn, Xian 710125, Shaanxi, Peoples R China"
,"Shaanxi Energy Inst, Coll Chem Engn, Xianyang 71200, Shaanxi, Peoples R China
;"
,"Shaanxi Inst Int Trade & Commerce, Coll Pharm, Xian 712046, Shaanxi, Peoples R China"
,"Shaanxi Inst Int Trade & Commerce, Coll Pharm, Xian 712046, Shaanxi, Peoples R China
;"
,"Shaanxi Inst Int Trade & Commerce, Coll Pharm, Xian 712046, Shaanxi, Peoples R China
;"
,"Shaanxi Key Laboratory of Comprehensive Utilization of Tailings Resources (Shangluo University), Shangluo, China ;"
,"Shaanxi Key Laboratory of Comprehensive Utilization of Tailings Resources (Shangluo University), Shangluo, China ;"
,"Shaanxi Key Laboratory of Network Data Intelligent Processing, Xi‘an University of Posts and Telecommunications, Xi‘an, China
;"
,"Shaanxi Key Laboratory of Surface Engineering and Remanufacturing, Xi’an University, Xi'an, 710065, China
;"
,"Shaanxi Nonnal Univ, Key Lab Appl Surface & Colloid Chem, Minist Educ, Xian 710119, Shaanxi, Peoples R China
;"
,"Shaanxi Nonnal Univ, Key Lab Modern Teaching Technol, Minist Educ, Xian, Shaanxi, Peoples R China"
,"Shaanxi Polytech Inst, Coll Informat Engn, Xianyang 712000, Peoples R China
;"
,"Shaanxi Polytech Inst, Coll Informat Engn, Xianyang 712100, Shaanxi, Peoples R China"
,"Shaanxi Research Center of Engineering Technology for Clean Coal Conversion, Chemical Engineering Research Center of the Ministry of Education for Advanced Use Technology of Shanbei Energy, School of Chemical Engineering Northwest University, Xi'an, Shaanxi Province, China ;"
,"Shaanxi Technical College of Finance and Economics, China;"
,"Shaanxi Technical College of Finance and Economics, Xianyang"
,"Shaanxi Technical College of Finance and Economics, Xianyang, Shaanxi Province"
,"Shaanxi Tradit Chinese Med Coll, Xianyang, Peoples R China"
,"Shaanxi Tradit Chinese Med Collage, Affiliated Hosp, Dept Urol, Xianyang, Shaanxi, Peoples R China"
,"Shaanxi Tradit Univ, Affiliated Hosp 2, Xianyang, Peoples R China"
,"Shaanxi TV & Radio Univ, Xian, Shaanxi, Peoples R China
;"
,"Shaan'xi University of Science and Technology, Xi'an, Shaanxi, China ;"
,"Shaanxi Xueclian Normal Univ, Dept Chem & Chem Engn, Shenhe 2nd Rd, Xian 710100, Peoples R China"
,"Shaanxi Xuegian Normal Univ, Coll Life Sci & Food Engn, Xian, Shaanxi, Peoples R China
;"
,"Shaanxi Xueqian Normal University, Xi'an"
,"Shaanxi Xueqian Normal University, Xi'an, Shaanxi"
,"Shama Univ, Sch Chem & Chem Engn, Taiyuan 030006, Peoples R China
;"
,"Shan Dong Career Dev Coll, Jining, Peoples R China"
,"Shan Dong Med Coll, Jinan 250002, Peoples R China"
,"Shan Dong Univ Finance & Econ, Sch Econ, Jinan, Peoples R China"
,"Shan Xi Light Ind & Tech Coll, Dept Elect & Mech Engn, Shanghai 030013, Peoples R China
;"
,"Shan Xi Pharmanceut Coll, Taiyuan 030031, Peoples R China
;"
,"Shandong Adv Coll Elect power, Jinan, Shandong, Peoples R China"
,"Shandong Agr Adm Coll, Jinan 250014, Peoples R China
;"
,"Shandong Agr Adm Coll, Jinan, Peoples R China"
,"Shandong Binhai University, Shandong, China
;"
,"Shandong Binzhou Polytechnic College, Binzhou 256603, China ;"
,"Shandong Career Dev Coll, Dept Energy & Mat Engn, Jining, Peoples R China
;"
,"Shandong Coll Highway Technician, Engn, 26777 East Jingshi Rd, Jinan 250002, Shandong, Peoples R China"
,"Shandong Coll Informat Technol, Weifang, Peoples R China"
,"Shandong Coll, Dept Lab Med, Jinan, Shandong, Peoples R China
;"
,"Shandong College of Mining Technical, Zibo, China
;"
,"Shandong Colleges and Universities Key Laboratory of New Energy Physics and Materials Science, Qingdao, China ;"
,"Shandong Commun & Media Coll, Jinan 250353, Shandong, Peoples R China"
,"Shandong First Univ, Shandong Prov Qianfoshan Hosp, Dept Pharm, Hosp 1, Jinan, Shandong, Peoples R China"
,"Shandong FirstMed Univ, Sch Stomatol, CONVERSATIONALIST Club, Tai An 271016, Shandong, Peoples R China"
,"Shandong Highway Technician Coll, Jinan 250104, Shandong, Peoples R China
;"
,"Shandong Huayu Univ Technol, Dezhou, Peoples R China
;"
,"Shandong Huayu Univ Technol, Engn & Technol R&D Ctr Clean Air Conditioning Col, Dezhou 253000, Peoples R China
;"
,"Shandong Huayu Univ Technol, Sch Elect Engn, Dezhou 254034, Peoples R China
;"
,"Shandong Huayu Univ Technol, Sch Energy & Environm Engn, Dezhou 253034, Peoples R China
;"
,"Shandong Huayu Univ Technol, Sch Energy & Environm Engn, Dezhou, Peoples R China"
,"Shandong Inst Commerce & Technol, Coll Humanities, Jinan 251013, Peoples R China"
,"Shandong Inst Commerce & Technol, Coll Informat & Art, Jinan, Shandong, Peoples R China
;"
,"Shandong Jianshu Univ, Sch Civil Engn, Fengming Rd, Jinan 250101, Shandong, Peoples R China
;"
,"Shandong Jianshu Univ, Sch Mat Sci & Engn, Jinan 250101, Shandong, Peoples R China
;"
,"Shandong Jianzhou Univ, Sch Civil Engn, Jinan, Shandong, Peoples R China
;"
,"Shandong Jining Technician College, Jining, Shandong, China;"
,"Shandong Kaiwen Coll Sci & Technol, Coll Automot Engn, Jinan 250200, Shandong, Peoples R China
;"
,"Shandong Kaiwen Coll Sci & Technol, Jinan 250200, Peoples R China"
,"Shandong Kaiwen Coll Sci & Technol, Sch Mech, Jinan 250200, Peoples R China"
,"Shandong Kaiwen Coll Sci & Technol, Sch Mech, Jinan 250200, Peoples R China"
,"Shandong Key Laboratory of Civil Engineering Disaster Prevention & Mitigation, College of Civil Engineering and Architecture, Shandong Univ. of Sci. & Tech., Qingdao, 266590, China
;"
,"Shandong Policy Coll, Publ Secur Dept, Jinan 250014, Peoples R China"
,"Shandong Prov Key Lab Fluorine Chem & Chem Mat, Key Lab Interfacial React & Sensing Anal Univ Sha, Jinan 250022, Shandong, Peoples R China
;"
,"Shandong Prov Univ, Key Lab Optoelect Mat Phys & Devices, Qingdao 266071, Peoples R China
;"
,"Shandong Prov Univ, Key Lab Optoelect Mat Phys & Devices, Qingdao 266071, Peoples R China
;"
,"Shandong Prov Univ, Key Lab Optoelect Mat Phys & Devices, Qingdao 266071, Peoples R China
;"
,"Shandong Province Key Lab of Civil Engineering Disaster Prevention and Mitigation, Shangdong University of Science and Technology, Qingdao, 266590, China
;"
,"Shandong Provincial Key Lab. of Marine Environment and Geological Engineering (Ocean Univ. of China), Qingdao, China ;"
,"Shandong Provincial Key Laboratory of Appraisal and Retrofitting in Building Structures, Shandong Jinzhu University, Jinan, China ;"
,"Shandong Provincial Key Laboratory of Civil Engineering Disaster Prevention and Reduction, Shangdong University of Science and Technology, Qingdao, Shandong 266590, China
;"
,"Shandong Provincial Key Laboratory of Depositional Mineralization & Sedimentary Minerals (Shangdong University of Science and Technology), Qingdao, China ;"
,"Shandong Provincial Key Laboratory of Depositional Mineralization & Sedimentary Minerals (Shangdong University of Science and Technology), Qingdao, China ;"
,"Shandong Provincial Key Laboratory of Depositional Mineralization & Sedimentary Minerals (Shangdong University of Science and Technology), Qingdao, Shandong, China;"
,"Shandong Research Center of Engineering and Technology for Clean Energy, Shangdong University of Technology, Zibo, Shandong, China ;"
,"Shandong Sch, Coll Med, Jinan 250012, Peoples R China"
,"Shandong Sci & Technol Univ, Tai An, Shandong, Peoples R China"
,"Shandong Traditional Chinese Medicine University, College of Pharmacy, Ji'nan 250012, China ;"
,"Shandong Traditional Chinese Medicine University, College of Pharmacy, Ji'nan 250012, China ;"
,"Shandong Univ Finance & Econ Lib, Jinan 250014, Shandong, Peoples R China
;"
,"Shandong Univ Sport, Dept Sports Sci, Jinan, Shandong, Peoples R China"
,"Shandong Univ Technogy, Coll Chem Engn, Zibo 255049, Shandong, Peoples R China"
,"Shandong University of Political Science and Law, Jinan, Shandong"
,"Shandong Urban Construct Coll, Jinan 250103, Shandong, Peoples R China"
,"Shandong Vormal Univ, Sch Phys & Elect, Jinan 250014, Shandong, Peoples R China
;"
,"Shandong Wan Jie Medical College, Zibo, Shandong, China ;"
,"Shandong Wanjie Med Coll, Shandong High Sch, Key Lab Biomed Engn & Technol, Zibo 255213, Peoples R China
;"
,"Shandong Wanjie Med Coll, Shandong High Sch, Key Lab Biomed Engn & Technol, Zibo 255213, Shandong, Peoples R China"
,"Shandong Water Polytech, Coll Resources, Rizhao 276826, Peoples R China"
,"Shandong Women Univ, Sch Informat Technol, Jinan, Shandong, Peoples R China"
,"Shandong Women’s University, Jinan"
,"Shandong Women's University ,  Jinan"
,"Shandong Xiandai Univ, Jinan, Shandong, Peoples R China"
,"Shandong Yingcai Coll, Sch Informat Engn, Jinan 250104, Shandong, Peoples R China
;"
,"ShandongUniv Technol, Coll Comp Sci & Technol, Zibo 255049, Peoples R China
;"
,"Shang Hai Univ Technol & Sci, Dept Energy & Power Engn, Shanghai, Peoples R China"
,"Shang Qiu Med Coll, Dept Lab Med, Shang Qiu, Peoples R China"
,"Shangai Tech Univ, Sch Phys Sci & Technol, Yueyang Campus,319 Yueyang Rd, Shanghai 200031, Peoples R China"
,"Shangdong Med Tech Coll, Tai An, Shandong, Peoples R China
;"
,"Shangdong Univ & Technol, Sch Chem Engn, Shandong 255049, Peoples R China
;"
,"Shangdong University of Science and Technology, China
;"
,"Shangdong University of Science and Technology, Department of civil engineer, Taian, Shandong, China ;"
,"Shangdong Wanjie Med Coll, Dept Pharm, Zibo 255213, Peoples R China"
,"Shangdong Woman Univ, Shandong 250300, Peoples R China"
,"Shangdong Womans Univ, Tourism Sch, Jinan 250300, Shandong, Peoples R China
;"
,"Shangdong Women's University, Jinan"
,"Shanghai Aurora Coll, Sch Publ Hlth, Shanghai 201908, Peoples R China"
,"Shanghai Aurora Coll, Sch Publ Hlth, Shanghai 201908, Peoples R China"
,"Shanghai Aurora Coll, Sch Publ Hlth, Shanghai 201908, Peoples R China
;"
,"Shanghai can Univ, Coll Food Sci & Technol, 999 Hucheng Huan Rd, Shanghai 201306, Peoples R China
;"
,"Shanghai Cicil Aviat Coll, Dept Bas, Shanghai 200232, Peoples R China
;"
,"Shanghai Civil Aviat Coll, Dept Aviat Transportat, Shanghai 200232, Peoples R China
;"
,"Shanghai Civil Aviat Coll, Shanghai 200232, Peoples R China
;"
,"Shanghai Civil Aviat Coll, Shanghai 200232, Peoples R China
;"
,"Shanghai Civil Aviation College, Aeronautical Maintenance Department, Shanghai, 200232, China
;"
,"Shanghai Civil Aviation College, Shanghai, China;"
,"Shanghai Civil Aviation College, Shanghai, China;"
,"Shanghai Coll Med & Hlth Sci, Shanghai 200237, Peoples R China
;"
,"Shanghai Collborat Innovat Ctr Biomfg Technol, Shanghai 200237, Peoples R China
;"
,"Shanghai College of Electrical Engineering, Shanghai, 201306, China
;"
,"Shanghai Communications Polytechnic College, Shanghai, China
;"
,"Shanghai Hlth Med Coll, Affiliated Zhoupu Hosp, Shanghai, Peoples R China
;"
,"Shanghai Hong Kou Spare Time Coll, Shanghai 200080, Peoples R China"
,"Shanghai Hosp Tradit Chinese Med, Coll Clin Med, Shanghai 200071, Peoples R China
;"
,"Shanghai Ist Med Univ, Huashan Hosp, Acupuncture Clin, Shanghai, Peoples R China"
,"Shanghai Jian Tong Univ, Key Lab Power Machinery, MOE, Shanghai 200240, Peoples R China"
,"Shanghai Jian Tong Univ, Shanghai, Peoples R China"
,"Shanghai Jianfeng College, Shanghai 201900, China ;"
,"Shanghai Jiguang Polytech Coll, 2859 Shuichan Rd, Baoshan Dist 201901, Peoples R China"
,"Shanghai Jiguang Polytech Coll, Nursing Sch, 2859 Shuichan Rd, Shanghai 201901, Peoples R China
;"
,"Shanghai Jiguang Polytech Coll, Shanghai, Peoples R China
;"
,"Shanghai Jingan Educ Coll, Affiliated Sch, Shanghai 200040, Peoples R China
;"
,"Shanghai Jino Tong Univ, Dept Civil Engn, Shanghai, Peoples R China
;"
,"Shanghai Key Lab Kidney & Blood Purificat, 136 Med Coll Rd, Shanghai 200032, Peoples R China
;"
,"Shanghai Key Lab of Power Station Automation Technology, School of Mechatronics Engineering and Automation,Shanghai University, Jing’an District, Shanghai, 200072, China
;"
,"Shanghai Key Laboratory of Power Station Automation Technology, Department of Automation Shanghai University, Shanghai, 20007, China
;"
,"Shanghai Key Laboratory of Power Station Automation Technology, School of Mechatronics Engineering and Automation of Shanghai University, Shanghai, China ;"
,"Shanghai Liao Tong Univ, Inst Refrigerat & Cryogen, Key Lab Power Mech Engn, MOE China, 800 Dongchuan Rd, Shanghai 200240, Peoples R China"
,"Shanghai Liao Tong Univ, Sch Life Sci & Biotechnol, Shanghai, Peoples R China"
,"Shanghai Liao Tong Univ, Sch Mech Engn, Shanghai Key Lab Digital Manufacture Thin Walled, State Key Lab Mech Syst & Vibrat, Shanghai, Peoples R China"
,"Shanghai Liao Tong Univ, Sch Phys & Astron, INPAC, Shanghai Key Lab Particle Phys & Cosmol,MOE Key L, 800 Dongchuan RD, Shanghai 200210, Peoples R China"
,"Shanghai Liao Tong Univ, Shanghai Peoples Hosp 10, Dept Orthodont, Collage Stomatol,Sch Med, Shanghai 200011, Peoples R China"
,"Shanghai Linxin Univ Accounting & Finance, Sch Business Adm, Shanghai, Peoples R China"
,"Shanghai Mao long Univ, Affiliated Peoples Hosp 6, Dept Rehabil Med, 600 Yishan Rd, Shanghai 200233, Peoples R China
;"
,"Shanghai Marine Univ, Merchant Marine Coll, Shanghai 201306, Peoples R China"
,"Shanghai Maritime Unvers, Merchant Marine Coll, Shanghai, Peoples R China"
,"Shanghai Martime Univ, Coll Informat, Shanghai, Peoples R China"
,"Shanghai Martime Univ, Merchant Marine Coll, Shanghai, Peoples R China"
,"Shanghai Normol Univ, Coll Life & Environm Sci, Shanghai 200234, Peoples R China
;"
,"Shanghai Ocean University Aquatic Animal Breeding Center, Shanghai University Knowledge Service Platform, Shanghai 201306, China ;"
,"Shanghai Pao Tong Univ, Sch Mat Sci & Engn, State Key Lab Met Matrix Composites, 800 Dongchuan Rd, Shanghai 200240, Peoples R China"
,"Shanghai Pao Tong Univ, Sch Mat Sci & Engn, State Key Lab Met Matrix Composites, Shanghai 200240, Peoples R China
;"
,"Shanghai Physicoengn Univ, Coll Med Equipment & Foods, Shanghai, Peoples R China"
,"Shanghai Ploytech Univ, Res Ctr Resource Recycling Sci & Engn, Shanghai 201209, Peoples R China"
,"Shanghai Program for Innovative Research Team in Universities, Shanghai 200072, China ;"
,"Shanghai Sanda Univ, Coll Management, Dept Food Qual & Safety, Shanghai 201209, Peoples R China
;"
,"Shanghai Sanda Univ, Dept Math, 2727 Jinhai Rd, Shanghai 201209, Peoples R China
;"
,"Shanghai Sanda Univ, Dept Math, 2727 Jinhai Rd, Shanghai 201209, Peoples R China
;"
,"Shanghai Sanda Univ, Dept Math, 2727 Jinhai Rd, Shanghai 201209, Peoples R China
;"
,"Shanghai Sanda Univ, Shengxiang Sch Business, Shanghai 201209, Peoples R China"
,"Shanghai Sci & Technol, Coll Sci, Shanghai 200093, Peoples R China
;"
,"Shanghai Technical College of Urban Management, Shanghai, China;"
,"Shanghai Technol Univ, Sch Phys Sci & Technol, Shanghai 200000, Peoples R China"
,"Shanghai Technol Univ, Sch Phys Sci & Technol, Shanghai 200031, Peoples R China"
,"Shanghai Technol Univ, Sch Phys Sci & Technol, Shanghai 200031, Peoples R China"
,"Shanghai Tianhua Coll, Shanghai, Peoples R China"
,"Shanghai Univ Appl Technol, 100 Haiquan Rd, Shanghai 201418, Peoples R China
;"
,"Shanghai Univ Appl Technol, 100 Haiquan Rd, Shanghai 201418, Peoples R China
;"
,"Shanghai Univ Engn & Technol, Shanghai 201600, Peoples R China"
,"Shanghai Univ kledicine & Hlth Sci, Affiliated Sixth Peoples Hosp, South Campus, Shanghai 201499, Peoples R China"
,"Shanghai Univ Med Hlth Sci, Coll Pharm, Shanghai, Peoples R China
;"
,"Shanghai Univ Med Hlth Sci, Shanghai, Peoples R China
;"
,"Shanghai Univ Medine & Hlth Sci, Sch Pharm, Shanghai, Peoples R China
;"
,"Shanghai Univ Sci & Engn, Sch Mat Engn, Shanghai 201620, Peoples R China
;"
,"Shanghai Univ Sci & Engn, Shanghai 201620, Peoples R China"
,"Shanghai University Institute of Materials, Shanghai, 200072, China
;"
,"Shanghai University Library, Shanghai, China
;"
,"Shanghai University of Engineering and Technology, China
[2] Shanghai University, China"
,"Shanghai University of Engineering and Technology, Longteng Road 333, Shanghai, 201620, China
;"
,"Shanghai University of Engineering, Science - School of Automobile Engineering, Long Teng Road 333, Shanghai, China ;"
,"Shanghai University of Medicine & Health Science, Shanghai, China;"
,"Shanghai University of Medicine and Health Sciences, Shanghai, China
;"
,"Shanghai University Research Center for Nanoscale Science and Technology, Shanghai, China ;"
,"Shanghai Urban Management College, Shanghai 200438, China ;"
,"Shanghai Xinqiao Polytech Coll, Shanghai, Peoples R China"
,"ShanghaiTechUniversity, Sch Life Sci & Technol, Shanghai 201210, Peoples R China
;"
,"ShangharTech Univ, Sch Life Sci & Technol, Shanghai 201210, Peoples R China
;"
,"Shangluo Coll, Dept Math & Computat Sci, Shangluo 726000, Peoples R China"
,"Shangluo College, Zhangye, Gansu, China ;"
,"Shangqiu Inst Technol, Coll Informat & Elect Engn, Shangqiu 476000, Peoples R China
;"
,"Shangqiu Noma Univ, Sch Chem & Chem Engn, Shangqiu 476000, Peoples R China
;"
,"Shangqiu Normal Coll, Dept Chem, Shangqiu 476000, Henan, Peoples R China"
,"Shangqiu Normal Coll, Dept Chem, Shangqiu 476000, Henan, Peoples R China"
,"Shangqiu Normal Coll, Dept Math, Shangqiu 476000, Henan, Peoples R China"
,"Shangqiu Normal Coll, Dept Phys, Shangqiu 476000, Peoples R China"
,"Shangqiu Normal University ,  Shangqiu"
,"Shangqiu Polytech, Coll Engn & Technol, 566 South Sect Shenhuo Ave, Shangqiu, Henan, Peoples R China
;"
,"Shangqiu Technician College, Shangqiu, Henan, China;"
,"Shangqiu Univ, Coll Comp Sci & Technol, Shangqiu 476000, Peoples R China
;"
,"Shangqiu Univ, Coll Comp Sci & Technol, Shangqiu 476000, Peoples R China
;"
,"Shangqiu Univ, Coll Landscape Architecture, Shangqiu 476000, Henan, Peoples R China"
,"Shangqiu Univ, Dept Phys Educ, Suiyang, Shangqiu, Peoples R China
;"
,"Shangqiu Univ, Sch Civil Engn, Shangqiu 476000, Peoples R China
;"
,"Shangqiu Univ, Sch Mech & Elect Informat Engn, Shangqiu 476000, Peoples R China
;"
,"Shangrao Normal Coll, Coll Phys & Elect Informat, Shangrao 334000, Jiangxi, Peoples R China"
,"Shangrao Normal Coll, Dept Biol Sci, Shangrao, Jiangxi, Peoples R China"
,"Shangrao Normal Coll, Shangrao 334001, Jiangxi, Peoples R China"
,"Shangrao Normal Coll, Shangrao 334001, Jiangxi, Peoples R China"
,"Shannxi University of Science and Technology, Xi'an 710021, China ;"
,"Shannxi Unvers Technol, Coll Phys, Hanzhong, Peoples R China
;"
,"Shantou Polytech Coll, Mech & Elect Dept, Shantou 515078, Guangdong, Peoples R China
;"
,"Shanxi Agr & Forest Univ, Coll Hort, Taigu, Shanxi, Peoples R China
;"
,"Shanxi Agr Univ Econ & Trade Coll, Taigu 030801, Shanxi Province, Peoples R China
;"
,"Shanxi Agricultral Univ, Coll Anim Sci & Vet Med, Taigu, Shanxi, Peoples R China"
,"Shanxi agricultural university academy economics and management, Jinzhong"
,"Shanxi Architectural Coll, Dept Municipal Engn, Wenhua St 369, Jinzhong 030619, Peoples R China
;"
,"Shanxi Architectural Coll, Taiyuan 030006, Peoples R China"
,"Shanxi Architectural Coll, Taiyuan 030006, Shanxi, Peoples R China"
,"Shanxi Architectural Coll, Taiyuan 030006, Shanxi, Peoples R China"
,"Shanxi Architectural Coll, Taiyuan 030006, Shanxi, Peoples R China"
,"Shanxi Aviat Profess Tech Inst, Coll Arts & Sci, Hanzhong 723102, Peoples R China"
,"Shanxi Coal Min Adm Coll, Dept Math, Taiyuan 030600, Peoples R China"
,"Shanxi Coal Min Adm Coll, Taiyuan 030006, Peoples R China
;"
,"Shanxi Coal Min Administators Coll, Taiyuan 030024, Peoples R China"
,"Shanxi Coal Min Administrators Coll, Taiyuan 030006, Peoples R China"
,"Shanxi Coal Min Administrators Coll, Taiyuan 030006, Peoples R China
;"
,"Shanxi Coal Mining Administrators College, Taiyuan, China;"
,"Shanxi Coal Mining Administrators College, Taiyuan, Shanxi, China ;"
,"Shanxi Coll Tradit Chinese Med, Ctr Lab Management, Taiyuan 0300024, Peoples R China"
,"Shanxi Coll Tradit Chinese Med, Taiyuan, Shanxi, Peoples R China
;"
,"Shanxi College of Traditional Chinese Medicine, Xianyang 712046, China ;"
,"Shanxi College of Traditional Chinese Medicine, Xianyang, China ;"
,"Shanxi Conservancy Tech Coll, Taiyuan 030000, Shanxi, Peoples R China"
,"Shanxi Conservancy Tech Coll, Yuncheng 044004, Peoples R China"
,"Shanxi Conservancy Tech Coll, Yuncheng 044004, Peoples R China"
,"Shanxi Conservancy Tech Coll, Yuncheng 044004, Peoples R China
;"
,"Shanxi Conservancy Technical College, Yuncheng, China ;"
,"Shanxi Conservancy Technical College, Yuncheng, China;"
,"Shanxi Conservancy Technical College, Yuncheng, Shanxi 044004, China ;"
,"Shanxi Conservancy Technical college, Yuncheng, Shanxi, China ;"
,"Shanxi Finance & Taxat Coll, Econ Informat Dept, Taiyuan 030024, Shanxi, Peoples R China"
,"Shanxi Finance gz Taxat Coll, Taiyuan 030051, Peoples R China"
,"Shanxi Ind & Trade Coll, Taiyuan 030024, Peoples R China"
,"Shanxi Inst Energy, 63 Univ St,Coll Pk, Jinshong 030600, Peoples R China
;"
,"Shanxi Key Laboratory of Comprehensive Utilization of Tailings Resources(Shangluo University), Shangluo, China;"
