中文单位名,英文单位名
,"Liaoning Adm Coll, Shenyang 110161, Liaoning, Peoples R China
;"
,"Liaoning Adm Coll, Shenyang 110161, Liaoning, Peoples R China
;"
,"Liaoning Agr Coll, Vet & Anim Husb Dept, Liaoning 115009, Peoples R China"
,"Liaoning Agr Coll, Yingkou 115009, Liaoning, Peoples R China
;"
,"Liaoning Agr Coll, Yingkou 115009, Liaoning, Peoples R China
;"
,"Liaoning Agr Coll, Yingkou 115009, Peoples R China
;"
,"Liaoning Chemical Ueological Exploration College, Jinzhou, 121007, China
;"
,"Liaoning College of Communication, Shenyang, China
;"
,"Liaoning Engineering Lab. of BeiDou High-precision Location Service, Dalian Univ., Dalian, 116622, China
;"
,"Liaoning Engn Technol Univ, Civil Engn & Transportat Inst, Fuxin Liaoning, Peoples R China"
,"Liaoning Engn Technol Univ, Civil Engn & Transportat Inst, Fuxing, Liaoning, Peoples R China"
,"Liaoning Equipment Mfg Coll, Shenyang 110161, Peoples R China"
,"Liaoning Equipment Mfg Coll, Shenyang 110161, Peoples R China"
,"Liaoning Heshi Med Coll, Sishui St 66, Shenyang 110163, Liaoning, Peoples R China
;"
,"Liaoning Inst Sci Tec, Elect informat Engn Coll, Benxi 117004, Peoples R China"
,"Liaoning Institute of Science and Technology, Metallurgical Engineering College, Benxi 117004, China ;"
,"Liaoning Key Lab of a Advanced Test Technology for Aerospace Propulsion System (Shenyang Aerospace University), Shenyang, Liaoning Province 110136, China
;"
,"Liaoning Mechatron Coll, Dandong 118009, Liaoning, Peoples R China
;"
,"Liaoning Mechatron Coll, Dandong 118009, Peoples R China"
,"Liaoning Natl Normal Coll, Informat Construct Dept, 45 Chongshan Rd, Shenyang 110032, Liaoning, Peoples R China
;"
,"Liaoning Nonnal Univ, Liaoning Prov Key Lab Biotechnol & Drug Discovery, Dalian 116029, Peoples R China
;"
,"Liaoning Petrochemical University, Shenyang, China ;"
,"Liaoning Prov Coll Commun Shenyang, Shenyang, Peoples R China"
,"Liaoning Prov Coll Commun, Dept Electromech Engn, Shenyang 110122, Liaoning, Peoples R China
;"
,"Liaoning Prov Coll Commun, Dept Electromech Engn, Shenyang 110122, Peoples R China
;"
,"Liaoning Prov Coll Commun, Dept Electromech Engn, Shenyang, Peoples R China
;"
,"Liaoning Prov Coll Commun, Dept Logist Management, Shenyang 110122, Peoples R China
;"
,"Liaoning Prov Coll Commun, Dept Mech & Elect Engn, 102 Shenbei Rd, Shenyang 110122, Peoples R China"
,"Liaoning Prov Coll Commun, Dept Mech & Elect Engn, 102 Shenbei Rd, Shenyang 110122, Peoples R China
;"
,"Liaoning Prov Coll Commun, Dept Mech & Elect Engn, 102 Shenbei Rd, Shenyang 110122, Peoples R China
;"
,"Liaoning Prov Coll Commun, Dept Mech & Elect Engn, Shenyang 110122, Peoples R China"
,"Liaoning Prov Coll Commun, Dept Rd & Bridge Engn, Shenyang 110122, Peoples R China"
,"Liaoning Prov Coll Commun, Dept Rd & Bridge Engn, Shenyang, Peoples R China"
,"Liaoning Prov Coll Commun, Dept Rd & Bridges, Shenyang, Peoples R China"
,"Liaoning Prov Coll Commun, Sch Rd & Bridges, Shenyang, Peoples R China
;"
,"Liaoning Prov Coll Commun, Shenyang 110122, Liaoning, Peoples R China
;"
,"Liaoning Prov Coll Commun, Shenyang 110122, Peoples R China
;"
,"Liaoning Prov Coll Commun, Shenyang, Liaoning, Peoples R China
;"
,"Liaoning Prov Coll Commun, Shenyang, Peoples R China"
,"Liaoning Prov Commun Coll, Dept Informat Engn, Shenyang 110122, Liaoning, Peoples R China
;"
,"Liaoning Province College of Communications, Shenyang"
,"Liaoning Provincial College of Communication, Shenyang, Liaoning, China;"
,"Liaoning Provincial Key Laboratory of Advanced Materials(Shenyang University), Shenyang, China ;"
,"Liaoning Tech Coll Equipment Mfg, Shenyang 110161, Peoples R China"
,"Liaoning Technology University Institute of Mechanical Engineering, Fuxin, 123000, China
;"
,"Liaoning TV & Radio Univ, Shenyang 110034, Liaoning, Peoples R China
;"
,"Liaoning Univ Business & Econ, Dalian 116052, Peoples R China
;"
,"Liaoning Univ Engn Sci, Inst Math, Fuxing 123000, Liaoning, Peoples R China"
,"Liaoning Univ Int Business & Econ, Coll Int Econ & Trade, Dalian 116052, Peoples R China"
,"Liaoning Urban Construct Tech Coll PC, Shenyang 110000, Liaoning, Peoples R China
;"
,"Liaoning Urban Construct Tech Coll, Inst Traff, Shenyang 110122, Peoples R China"
,"Lib Dali Univ, Dali 671003, Yunnan, Peoples R China"
,"Lib Jianghan Univ, Wuhan 430056, Hubei, Peoples R China"
,"Lib Jianghan Univ, Wuhan 430056, Hubei, Peoples R China"
,"Lib Shandong Univ Arts, Jinan 250014, Shandong, Peoples R China
;"
,"Lib Shandong Youth Univ Polit Sci Jinan, Jinan, Shandong, Peoples R China"
,"Lib Xian Technol Univ, Xian 710032, Shaanxi, Peoples R China
;"
,"Library China West Normal University, Nanchong, 637000, China
;"
,"Library of University of Electronic Science and Technology of China, Chengdu, 610054, China
;"
,"Library of Xinjiang University, Urumqi, 830046, China
;"
,"Library of Xinjiang University, Urumqi, 830046, China
;"
,"Lienta Univ, English Poetry & Naval Architecture, Kunming, Yunnan, Peoples R China
;"
,"Life Sci & Environm Sci Res Ctr Harbin Univ Comme, Harbin 150025, Peoples R China
;"
,"Life Science & Engineering College of South-west Jiao-tong University, Chengdu, China ;"
,"Life Science and Technology School, Mudanjiang Teachers College, Mudanjiang, China ;"
,"Life Sciences and Technology College, Hehei Normal University of Science and Technology, Changli 066600, China ;"
,"Light Textile Institute, University of Qiqihar, Qigihar, China ;"
,"Light Textile Institute, University of Qiqihar, Qiqihar 161000, China ;"
,"Lijiang Teacher Coll, Sch Appl Technol, Lijiang 674100, Peoples R China
;"
,"Lijiang Teachers Coll, Coll Life Sci, Lijiang 674100, Peoples R China"
,"Lijiang Teachers Coll, Dept Life Sci, Lijiang 674100, Yunnan, Peoples R China"
,"Lijiang Teachers Coll, Dept Math & Comp Sci, Lijiang 674199, Peoples R China
;"
,"Lijiang Teachers Coll, Dept Teachers Educ, Lijiang 674199, Peoples R China
;"
,"Lijiang Teachers Coll, Lijiang 674110, Yunnan Province, Peoples R China"
,"Lijiang Teachers Coll, Sch Appl Technol, Lijiang 674199, Peoples R China
;"
,"Lincang Teachers Coll, Dept Math & Sci, Lincang, Peoples R China"
,"Lincang Teachers Coll, Dept Math & Sci, Lincang, Peoples R China"
,"Lincang Teachers Coll, Dept Phys, Lincang 677000, Peoples R China"
,"Lincang Teachers Coll, Lincang 677000, Yunnan, Peoples R China"
,"Lincoln Institute for Agri-Food Technology, University of Lincoln, Brayford Pool, Lincoln"
,"Lingnan Normal Coll, Dept Phys, Zhanjiang 524048, Peoples R China
;"
,"Lingnan Normal Coll, Dept Phys, Zhanjiang 524048, Peoples R China
;"
,"Lingnan Normal Coll, Dept Phys, Zhanjiang 524048, Peoples R China
;"
,"Lingnan Normal Coll, Sch Math & Stat, Zhanjiang 524048, Peoples R China"
,"Linkoping Univ Guangzhou Univ Res Ctr Urban Susta, Guangzhou 510006, Guangdong, Peoples R China
;"
,"Linyi Med Coll, Linyi, Shandong, Peoples R China
;"
,"Linyi Univ Off, Linyi 276005, Shandong, Peoples R China"
,"Liupanshui Normal College, Liupanshui, 550018, China
;"
,"Liupanshui Normal Univ D Liupanshui, Sch Chem & Mat Engn, Inst Liupanshui Normal Univ, Guizhou 553004, Peoples R China"
,"Liupanshui Normal Univ DLiupanshui, Sch Chem & Mat Engn, Inst Liupanshui Normal Univ, Liupanshui 553004, Guizhou, Peoples R China
;"
,"Livaqiao Univ, Coll Mat Sci & Engn, Quanzhou 362021, Peoples R China"
,"Lixin Univ Accounting & Finance, Shanghai 201620, Peoples R China
;"
,"LMEET Laboratory of FST, University of Hassan 1"
,"LMW, Siegen University, Paul-Bonatz-Str. 9-11, Siegen"
,"Logisit Engn Univ, Dept Fdn Studies, Chongqing 400016, Peoples R China"
,"Logist Engn Coll, Chongqing Key Lab Geomech & Geoenvironm Protect, Chongqing 401311, Peoples R China"
,"Logist Engn Coll, Dept Architecture & Engn, Chongqing 400041, Peoples R China"
,"Logist Engn Coll, Dept Architecture & Engn, Chongqing, Peoples R China"
,"Longdong College, Qingyang, 745000, China
;"
,"Longnan Normal Coll, Dept Biol & Chem, Chengxian 742500, Peoples R China"
,"Longnan Normal Coll, Dept Biol & Chem, Chengxian 742500, Peoples R China
;"
,"Longnan Normal Coll, Dept Biol & Chem, Chengzian 742500, Peoples R China"
,"LongnanNormal Coll, Sch Agr & Forestry Technol, Longnan 742500, Peoples R China"
,"Longqiao Coll Lanzhou Commercial Coll, Dept Math, Lanzhou 730101, Gansu, Peoples R China
;"
,"Loudi Presch Normal Educ Coll, Dept Basic, Lengshuijiang, Peoples R China
;"
,"LRM, Hassiba Benbouali University of Chlef, Esalem"
,"LRM, Hassiba Benbouali University of Chlef, Faculty of Technology, Esalem"
,"LS2N (Laboratory of Digital Sciences of Nantes), Nantes University, 2 avenue du professeur Jean Rouxel, Carquefou"
,"LS2N (Laboratory of Digital Sciences of Nantes, UMR CNRS 6004), University of Nantes, Nantes"
,"LSI/PSI/EPUSP, University of S?o Paulo, S?o Paulo, SP"
,"Lu Liang University, Shanxi, China
;"
,"Luanghtiai Univ, Sch Informat Engn, Henan Int Joint Lab Behav Optimizat Control Smart, Zhumadian 463000, Peoples R China
;"
,"Luliang University, Luliang 033000, China ;"
,"Luliang University, Lvliang, Shanxi 033000, China
;"
,"Luoyang Normal College, Luoyang 471022, China ;"
,"Luoyang Normal University, Luoyang"
,"Luoyang Teachers Coll, Dept Math, Luoyang 471022, Peoples R China"
,"LUT University, Yliopistonkatu 34, Lappeenranta"
,"LUT, Coll Mech & Elect Engn, Lanzhou 730050, Peoples R China"
,"Luzhou Vacat & Tech Coll, Luzhou, Sichuan, Peoples R China
;"
,"Lviv State University of Internal Affairs, Lviv Horodotska str. 26, Lviv"
,"Lvliang College, Lishi, China ;"
,"Lvliang University Department of Chemical, Lvliang, 033001, China
;"
,"M. Tech Power Systems, Sastra University ;"
,"M?lardalen University, School of Business, Society and Engineering, P.O. Box 883, V?ster?s"
,"Maanshan Teachers Coll, Dept Math, Maanshan 243000, Peoples R China
;"
,"Maanshan Teachers Coll, Dept Math, Maanshan 243000, Peoples R China
;"
,"Maanshan Teachers Coll, Dept Math, Maanshan 243000, Peoples R China
;"
,"Maanshan Teachers Coll, Maanshan 243041, Peoples R China"
,"Maanshan Teachers Coll, Maanshan, Peoples R China
;"
,"Maanshan Teacher's College, Anhui, Maanshan"
,"Maanshan Tech Coll, Dept Elect Engn, Maanshan 243031, Anhui, Peoples R China
;"
,"Machine Engn Coll, Shijiazhuang 050003, Peoples R China"
,"Machine Engn Coll, Shijiazhuang 050003, Peoples R China"
,"Machine Engn Coll, Shijiazhuang, Peoples R China"
,"Machining Department, Qinhuangdao Technician College, Qinhuangdao, 066004, China
;"
,"Maintenance Depot of Shijiazhuang Flying College, Shijiazhuang, Hebei 050003, China
;"
,"Maintenance Depot, Shijiazhuang Flying College, Shijiazhuang, Hebei, China ;"
,"Man Univ, Dept Mat Sci, Shanghai 200433, Peoples R China
;"
,"Management Academy of Chongqing Jiao-tong University, Chongqing, 400074, China
;"
,"Management Office of Scientific Research ,  Pingxiang College, Pingxiang, Jiangxi"
,"Management Office of Scientific Research, Pingxiang College, Pingxiang, Jiangxi"
,"Manufacturing Research Laboratory, Sabanci University, Tuzla, Istanbul"
,"Maotai Univ, Dept Food Sci & Engn, Renhuai, Peoples R China"
,"MARCS Institute for Brain, Behaviour and Development, School of Computing, Engineering and Mathematics, Western Sydney University, Milperra"
,"Mari State University, Yoshkar-Ola ;"
,"Marine Environm Coll, Dalian, Peoples R China"
,"Maritime Safety Adm Peoples Republ China, Coll Environm Sci & Engn, Beijing 100736, Peoples R China
;"
,"Marmara University, Department of Educational Sciences;"
,"Marx College of Anshun University, Guizhou Anshun"
,"Marxs Coll Anhui Univ Technol, Maanshan 243000, Peoples R China
;"
,"Mat Coll, Beijing 101416, Peoples R China
;"
,"Mat Sci & Engn Coll, Qingdao 266071, Peoples R China
;"
,"Material Department in College of Engineering, Yantai South Mountain University, Longkou, China ;"
,"Material Department in College of Engineering, Yantai South Mountain University, Longkou, China;"
,"Material Science and Engineering in the Graduate School of Lanzhou University of Tech., Lanzhou, Gansu, China ;"
,"Materials Science and Engineering College of Guilin University of Technology, Guilin, China ;"
,"Mathematical Institute, University of Oxford, Oxford"
,"Mathematics Department, Erzurum Techinal University, 25240, Erzurum, Turkey ;"
,"Mathematics Institute, Taiyun University of Technology, Taiyuan, China ;"
,"Mathmatics Department, Yangen University, Quanzhou, China
;"
,"McGill Univ, *, *, *
;"
,"McGill University, Montreal"
,"Mec Engn Coll, Dept 7, Shijiazhuang, He Bei Province, Peoples R China"
,"Mech & Elect Engn Coll, Xinxiang 453002, Peoples R China"
,"Mech Coll, Chongqing 400044, Peoples R China"
,"Mech. Eng. Dept., Engineering Faculty of Balikesir University, Balikesir"
,"Mechanic and Electronic Engineering, Gulin University of Electronic Technology, Guilin, 541004, China
;"
,"Mechanic and Electronic Engineering, Gulin University of Electronic Technology, Guilin, China ;"
,"Mechanical and Electrical Department, Shantou Polytechnic College, Shantou, Guangdong, China;"
,"Mechanical and Electrical Department, Technology and Business College, China ;"
,"Mechanical and Electrical Engineering College, Harbin University of Engineering, Harbin, 150001, China
;"
,"Mechanical and Electrical Engineering College, Harbin University of Engineering, Harbin, 150001, China
;"
,"Mechanical and Electrical Engineering College, Jinhua College of Profession and Technology, Jinhua 321017, China ;"
,"Mechanical and Electrical Engineering Department, Chizhou College, Chizhou, China ;"
,"Mechanical and Electrical Engineering Division, Wenhua University, Wuhan, China;"
,"Mechanical and Electrical Engineering Institute of Xinjiang Agricultural University, Urumqi, 830091, China
;"
,"Mechanical and Electronic Engineering College, Xuzhou Institute of Technology, Xuzhou 221008, China ;"
,"Mechanical and Electronic Engineering Department, Long Dong University, Qingyang, 745000, China
;"
,"Mechanical and Electronic Engineering Innovation Research Center, Xi’an University, Xi'an, 710065, China
;"
,"Mechanical and Power Engineering, College of Yingkou Institute of Technology, Yingkou, China"
,"Mechanical Department, GIDC Degree Engineering College, Abrama"
,"Mechanical Engineering Department, Benha Faculty of Engineering, Benha University, Benha, Qalubia"
,"Mechanical Engineering Department, NED University of Engineering and Technology, Karachi"
,"Mechanical Engineering Department, Prince Sultan Endowment for Energy and Environment, Prince Mohammad Bin Fahd University, Al-Khobar"
,"Mechanical Engineering Department, School of Engineering and Engineering Technology, Federal University of Technology Akure, Akure"
,"Mechanical Engineering Department, Stellenbosch University, Stellenbosch"
,"Mechanical Engineering Department, Zheng Zhou Technical College, Zhengzhou, China ;"
,"Mechanical Engineering Education Department, Universitas Sebelas Maret, Jl. Ir. Sutami No.36A, Surakarta, Jawa Tengah"
,"Mechanical Engineering Education Department, Universitas Sebelas Maret, Jl. Ir. Sutami No.36A, Surakarta, Jawa Tengah"
,"Mechanical Engineering Education, Universitas Negeri Sebelas Maret, Jl. Ir. Sutami 36A, Surakarta"
,"Mechanical Engineering Institute of Qiqihaer University, Qiqihaer, China ;"
,"Mechanical Engineering Institute, Hunan Industry University, Zhuzhou, China ;"
,"Mechanical Engineering School of Hubei University of Technology, Wuhan, 430068, China
;"
,"Mechanical Information Research Center of Jiangsu Univ., Zhenjiang"
,"Mechanical Technology College, Wuhan, Hubei, China
;"
,"Mechatron Engn Coll, Jinling Inst Technol, Nanjing 211169, Jiangsu, Peoples R China"
,"Mechatronics Engineering Department, Yuncheng University, Yuncheng"
,"Mechn Engn Coll, Staff Room Phys Chem, Shijiazhuang 050003, Peoples R China"
,"Mechnical Engineering College, Shijiazhuang, China;"
,"Med Coll Taishan, Yantaishan Hosp, Dept Otorhinolaryngol, Yantai, Peoples R China"
,"Med Coll, Dept Pediat, Changchun, Jilin, Peoples R China
;"
,"Med Coll, Hangzhou, Zhejiang, Peoples R China
;"
,"Med Res Cent First Coll Clin Med, Nanjing, Jiangsu, Peoples R China
;"
,"Med Univ Amer, Whitehall, St Kitts & Nevi
;"
,"Med Univ Fujian, Sch Pharm, Dept Pharmacol, Fuzhou 350122, Fujian, Peoples R China
;"
,"Med Univ TaiShan, Tai An, Peoples R China
;"
,"Med Univ TaiShan, Tai An, Shandong, Peoples R China
;"
,"Media Integration and Communication Center, University of Florence, Florence"
,"Medical College of Shandong University
;"
,"Medical College, Hu'nan Normal University, Changsha, China ;"
,"Medical College, Southwest Jaotong University, Chengdu, 610031, China
;"
,"Merchant Marine College, Guangxi Hualan Design & Consulting Group, No. 39 Huadong Road, Nanning, China;"
,"Metallurgical and Material Engineering Department, Jadavpur University, Kolkata, China ;"
,"Metallurgical Engineering Department, Vanderbijlpark Campus, Vaal University of Technology, Private Bag X021, Vanderbijlpark"
,"Mewbourne College of Earth and Energy, University of Oklahoma, 660 Parrington Oval, Norman"
,"Mhamed Bougara Univ, Fac Engn Sci, Res Unit Mat Proc & Environm UR MPE, Dept Ind Proc Engn, Boumerdes 35000, Peoples R China"
,"Mian Yang Normal Univ, Foreign Language Sch, Mianyang 621006, Sichuan, Peoples R China"
,"Mianyang TeachersColl, Sch Informat Engn, Mianyang, Sichuan, Peoples R China"
,"Michigan Technological University (MTU), Hougton"
,"Michigan Technological University, Houghton"
,"Michigan Technological University, Houghton"
,"Micro System Integration Center, Tohoku University, Sendai"
,"Microelectronics Department, Technical University of Sofia, Sofia"
,"Micro-satellite Research Center, Zhejiiang University, Hangzhou, 310027, China
;"
,"Middle East Technical University, Ankara"
,"Middle South Univ, Haikou Municipal Hosp, Xiangya Haikou Hosp, Dept Vasc Surg & Gen Surg, Haikou 570208, Peoples R China"
,"Mil Transportat Coll, Basic Dept, Tianjin 300161, Peoples R China"
,"Mil Transportat Coll, Basic Dept, Tianjin 300161, Peoples R China
;"
,"Mil Transportat Coll, Tianjin 300161, Peoples R China"
,"Mil Transportat Coll, Tianjin 300161, Peoples R China"
,"Milian Univ Technol, State Key Lab Adv Technol Mat Synth & Proc, Wuhan 430070, Peoples R China"
,"Military College of Engineering (MCE), National University of Sciences and Technology (NUST), Risalpur Campus, Islamabad"
,"Military College of Nanchang, Nanchang, China ;"
,"Military Dept. of Civil Eng., Logistical Eng. Univ., Chongqing, China ;"
,"Military Transportat Univ, Tianjin 300161, Peoples R China"
,"Military Transportation College, Tianjin 300161, China ;"
,"Military Transportation College, Tianjin 300161, China ;"
,"Min Zu Univ China, Coll Life & Environm Sci, Beijing 100081, Peoples R China"
,"Mines ParisTech, PSL Research University, Centre for Applied Mathematics, 1 rue Claude Daunesse, Sophia Antipolis"
,"MINES ParisTech, PSL, Research University, Centre for Applied Mathematics, Sophia Antipolis"
,"Mines Saint-Etienne, Univ. Clermont Auvergne, CNRS, UMR 6158 LIMOS, Institut Henri Fayol, Saint-Etienne"
,"Mines Saint-Etienne, Univ. Lyon, Univ. Jean Moulin, Univ. Lumire, Univ. Jean Monnet, ENTPE, INSA Lyon, ENS Lyon, CNRS, UMR 5600 EVS, Institut Henri Fayol, Saint-Etienne"
,"Mines Saint-Etienne, Univ. Lyon, Univ. Lumire, Univ. Jean Monnet, EA 4161, COACTIS, Institut Henri Fayol, Saint-Etienne"
,"Ming Chuan Univ, Dept Biotechnol, Taoyuan, Peoples R China"
,"Ming Industry Technology College, Huludao, Liaoning, China ;"
,"Minghua Univ, Inst Microelect, Beijing 10084, Peoples R China
;"
,"Mingjiang Normal Coll, Dept Social Sci, Fuzhou 350117, Fujian, Peoples R China
;"
,"MingJiang Univ, Dept Comp Sci, Fuzhou 350108, Fujian, Peoples R China"
,"Mingjiang Univ, Fujian Prov Key Lab Informat Proc & Intelligent C, Fuzhou 350121, Fujian, Peoples R China
;"
,"Mining College of Guizhou Institute of Technology, Guiyang, 550003, China
;"
,"Mining College, Hulunbuir University, Hulunbuir, 021008, China
;"
,"Mining Engineering Department, McGill University, Montreal"
,"Minist Agr, Coll Biol Sci & Engn, Key Lab Urban Agr North China, Beijing 102206, Peoples R China
;"
,"Minist Agr, Coll Fisheries, Key Lab Hlth Mariculture East China Sea, Beijing, Peoples R China"
,"Minist Agr, Coll Vet Med, MOE Joint fntemat Res Lab Anim Hlth & Food Safety, Key Lab Anim Bacteriol, Beijing, Peoples R China
;"
,"Minist Agr, Northeast Key Lab Conservat & Improvement Cultiva, Coll Land & Environm Shenyang Agr Univ, Shenyang 110866, Liaoning, Peoples R China
;"
,"Minist China, Key Lab Colloid & Interface Chem Educ, Jinan, Peoples R China"
,"Minist Educ & Guangdong Prov, Shenzhen Key Lab Two Dimens Mat & Devices, Shenzhen Engn Lab Phosphorene & Optoelect, Key Lab Optoelect Devices & Syst,Collaborat Innov, Shenzhen 518060, Guangdong, Peoples R China
;"
,"Minist Educ & Guangdong, Collaborat Innovat Cent Optoelect Sci & Technol, Shenzhen Engn Lab Phosphorene & Optoelect, Key Lab Optoelect Devices & Syst,Shenzhen Key Lab, Shenzhen 518060, Guangdong, Peoples R China
;"
,"Minist Educ & Guangdong, Collaborat Innovat Ctr Optoelect Sci & Technol, Shenzhen Engn Lab Phosphorene & Optoelect, Shenzhen Key Lab Two Dimens Mat & Devices,Key Lab, Shenzhen, Guangdong, Peoples R China
;"
,"Minist Educ China, Inst Cardiovasc Res, Collaborat Innovat Ctr Prevent & Treatment Cardio, Key Lab Med Electrophysiol, Beijing, Peoples R China
;"
,"Minist Educ, Coll Chem & Mat Sci, Key Lab Synthet & Nat Funct Mol Chem, Beijing, Peoples R China
;"
,"Minist Educ, Coll Chem & Mat Sci, Key Lab Synthet & Nat Funct Mol Chem, Shaanxi Prov Key Lab Electroanalyt Chem, Xian 710069, Shaanxi, Peoples R China
;"
,"Minist Educ, Coll Chem, Key Lab Adv Energy Mat Chem, Beijing, Peoples R China
;"
,"Minist Educ, Coll Chem, Key Lab Adv Energy Mat Chem, Tianjin 300071, Peoples R China
;"
,"Minist Educ, Coll Chem, Key Lab Funct Polymer Mat, Tianjin 300071, Peoples R China
;"
,"Minist Educ, Coll Chem, Key Lab Green Chem & Technol, Chengdu 610064, Sichuan, Peoples R China
;"
,"Minist Educ, Coll Environm Sci & Engn, State Key Lab Pollut Control & Resource Reuse, Key Lab Yangtze River Water Environm, Shanghai 200092, Peoples R China
;"
,"Minist Educ, Coll Environm Sci & Engn, State Key Lab Pollut Control & Resources Reuse, Key Lab Yangtze Water Environm, Shanghai 200092, Peoples R China
;"
,"Minist Educ, Coll Life Sci, Key Lab Bioresources & Ecoenvironm, Chengdu 610064, Peoples R China
;"
,"Minist Educ, Coll Mat & Text, Key Lab Adv Text Mat & Mfg Technol, Beijing, Peoples R China
;"
,"Minist Educ, Key Lab Adv Text Mat & Mfg Technol, Coll Mat & Text, Beijing, Peoples R China
;"
,"Minist Educ, Key Lab Appl Surface & Colloid Chem, Key Lab Macromol Sci Shaanxi Prov, Xian, Shaanxi, Peoples R China
;"
,"Minist Educ, Key Lab Appl Surface & Colloid Chem, Xian 710062, Peoples R China"
,"Minist Educ, Key Lab Appl Surface & Colloid Chem, Xian 710062, Peoples R China"
,"Minist Educ, Key Lab Appl Surface & Colloid Chem, Xian 710062, Peoples R China"
,"Minist Educ, Key Lab Appl Surface & Colloid Chem, Xian 710119, Shaanxi, Peoples R China
;"
,"Minist Educ, Key Lab Appl Surface & Colloid Chem, Xian 710119, Shaanxi, Peoples R China
;"
,"Minist Educ, Key Lab Coastal & Wetland Ecosyst, Coastal & Ocean Management Inst, Coll Environm & Ecol, Xiamen 361102, Fujian, Peoples R China
;"
,"Minist Educ, Key Lab Ecotext, Coll Text & Clothing, Wuxi 214122, Peoples R China"
,"Minist Educ, Key Lab High Performance Plast, Coll Chem, Changchun 130012, Jilin, Peoples R China
;"
,"Minist Educ, Key Lab Polymer Mat & Applicat Technol Hunan Prov, Key Lab Environm Friendly Chem & Applicat, Key Lab Adv Funct Polymer Mat,Coll Hunan Prov, Xiangtan 411105, Hunan, Peoples R China"
,"Minist Educ, Key Lab Southwest China Wildlife Resources Conser, Coll Life Sci, 1 Shida Rd, Nanchong 637009, Sichuan, Peoples R China
;"
,"Minist Educ, Key Lab Synerget & Biol Colloids, 1800 LiHu Ave, Wuxi 214122, Jiangsu, Peoples R China
;"
,"Minist Educ, Key Lab Synthet & Biol Colloids, Wuxi 214122, Jiangsu, Peoples R China
;"
,"Minist Educ, Key Lab Synthet & Biol Colloids, Wuxi 214122, Peoples R China
;"
,"Minist Educ, Key Lab Synthet & Biol Colloids, Wuxi 214122, Peoples R China
;"
,"Minist Educ, Key Lab Synthet & Biol Colloids, Wuxi 214122, Peoples R China
;"
,"Minist Educ, Key Lab Synthet & Biol Colloids, Wuxi 214122, Peoples R China
;"
,"Minist Educ, Key Lab Synthet & Biol Colloids, Wuxi 214122, Peoples R China
;"
,"Minist Educ, Key Lab Synthet & Biol Colloids, Wuxi 214122, Peoples R China
;"
,"Minist Educ, Key Lab Synthet & Biol Colloids, Wuxi, Peoples R China
;"
,"Minist Educ, Key Lab Trop Biol Resources, State Key Lab Marine Resource Utilizat South Chin, Coll Marine Sci, Haikou 570228, Hainan, Peoples R China
;"
,"Minist Educ, Key Lab Universal Wireless Commun BUPT, Beijing, Peoples R China"
,"Minist Educ, Key Lab Universal Wireless Commun BUPT, Beijing, Peoples R China"
,"Minist Educ, Key Lab Universal Wireless Communit BUPT, Beijing, Peoples R China
;"
,"Minist Educ, Program New Century Excellent Talents Univ, Beijing, Peoples R China
;"
,"Minist Educ, Sch Chem & Chem Engn, Key Lab Appl Surface & Colloid Chem, Xian 710119, Shaanxi, Peoples R China
;"
,"Minist Educ, Sch Chem & Mat Engn, Key Lab Synthet & Biol Colloids, Wuxi 214122, Jiangsu, Peoples R China
;"
,"Minist Hlth China, Zhejiang Prov Key Lab Neurobiol, Key Lab Med Neurobiol,Coll Pharmacol Sci, Dept Pharmacol,Sch Basic Med Sci, Hangzhou 310058, Zhejiang, Peoples R China"
,"Minist Hlth, Collaborat Innovat Haematol, Inst Blood & Marrow Transplantat, Key Lab Thrombosis & Hemostasis, Suzhou 215000, Peoples R China
;"
,"Minist Sci & Technol, Int Base Collaborat Sci & Technol JNU, Guangzhou 510632, Guangdong, Peoples R China"
,"Minist Sci & Technol, Int Base Collaborat Sci & Technol JNU, Guangzhou 510632, Guangdong, Peoples R China"
,"Minjiang Teachers College, Fuzhou, Fujian Province"
,"Minnan Mormal Univ, Sch Comp Sci, Key Lab Data Sci & Intelligence Applicat, Zhangzhou, Peoples R China
;"
,"MIREA- Russian Technological University, Moscow"
